Όνομα;Χονδρική τιμή (€);Λιανική τιμή (€);Περιγραφή;Κατηγορία;Barcode (EAN);Παραλλαγές (variants);Φωτογραφία;URL επίσημου site
Frezyderm Aqua Care Gel Lubricant Care 50g | Pharm24.gr;10,15;17,00;Frezyderm Aqua Care Gel Lubricant Care 50g - Ενυδατική & Λιπαντική Αιδιοκολπική Γέλη για Χρήση Κατά την Εμμηνόπαυση σε προσφορά στο Pharm24.gr. Δωρεάν μεταφορικά σε αγορές άνω των 69€ για μέλη.;Διάφορα;5202888227554;;frezyderm/aqua-care-gel-lubricant-care-50g-pharm24-gr-5202888227554.jpg;https://www.pharm24.gr/frezyderm-aqua-care-gel-lubricant-care-50g-p-63322.html
Frezyderm Baby Hydra Milk;10,74;17,98;Ενυδατικό γαλάκτωμα κατάλληλο για το ξηρό και ευαίσθητο δέρμα. Με φυσιολογικούς ενυδατικούς παράγοντες για πλούσια και σε βάθος ενυδάτωση του δέρματος. Περιποιείται και μαλακώνει το δερματάκι του μωρού και προλαμβάνει την αφυδάτωση και την ξηροδερμία. Εμπλουτισμένο με πρωτεΐνες σιταριού για την ενίσχυση του υδρολιπιδικού μανδύα, που αφήνει ένα λεπτό στρώμα υδρολιπιδικής ισορροπίας για την προστασία της επιδερμίδας από ερεθισμούς. Παράλληλα, περιέχει εκχύλισμα χαμομηλιού για αντιφλογιστική και αντιερεθιστική δράση και αντιφλογιστικά συστατικά με επουλωτικές και καταπραϋντικές ιδιότητες.Δερματολογικά ΕλεγμένοΝέα ΜΕΓΑΛΥΤΕΡΗ συσκευασία με πρακτική αντλίαΕπισκεφθείτε τη Frezyland για το πρώτο...;Φροντίδα Μωρού;5202888230189;;frezyderm/baby-hydra-milk-5202888230189.jpg;https://www.frezyderm.gr/frontida-mwrou/brefiko-galaktoma/baby-hydra-milk-brefiko-galaktwma/
Frezyderm Body Shower Revitalizing Cleanser;7,72;12,92;"Απαλό καθαριστικό σώματος για το καθημερινό ντους, ιδιαίτερα των ευαίσθητων και ερεθισμένων επιδερμίδων. Περιποιείται το ξηρό, αφυδατωμένο δέρμα και ανακουφίζει από τον κνησμό. Τα ενεργά συστατικά του μειώνουν τους ερεθισμούς, ενυδατώνουν και αυξάνουν την αντοχή του δέρματος.&amp;nbsp;Ιδανικό και για την περιποίηση της επιδερμίδας κατά την περίοδο της εγκυμοσύνης.Συνδυάζεται με την Prevenstria Cream για την πρόληψη δημιουργίας ραβδώσεων (ραγάδων) καθώς και με την Triple Effect Body Contouring Frosted Gel για την αντιμετώπιση της κυτταρίτιδας.Τοξικολογικό Τεστ ΑσφάλειαςΒραβευμένο με το βραβείο Prix De Beaute 2014 ως το καλύτερο προϊόν στην κατηγορία &quot;Περιποίηση – Αδυνάτισμα Σώματος&quot;";Περιποίηση Σώματος;5202888227158;;frezyderm/body-shower-revitalizing-cleanser-5202888227158.jpg;https://www.frezyderm.gr/peripoiisi-somatos/afroloutra/body-shower-katharistiko-swmatos-euaisthhth-epidermida/
Frezyderm Christialen Emulsion;11,18;18,72;Ενυδατικό γαλάκτωμα σώματος για την καθημερινή περιποίηση και θρέψη του δέρματος. Ενυδατώνει άμεσα και σε βάθος την επιδερμίδα σας, αποκαθιστώντας το υδατικό ισοζύγιο, ενώ παράλληλα αποτελεί μια ασπίδα προστασίας από δυσμενείς περιβαλλοντικές συνθήκες. Με δροσερή λεπτόρρευστη και μη λιπαρή υφή που δεν αφήνει ίχνη λιπαρότητας και σας επιτρέπει να ντυθείτε αμέσως. Απλώστε το στην επιδερμίδα σας μετά το ντους και ζήστε την εμπειρία της μεταξένιας επιδερμίδας.Δερματολογικά Ελεγμένο;Περιποίηση Σώματος;5202888100413;5202888271090;frezyderm/christialen-emulsion-5202888100413.jpg;https://www.frezyderm.gr/peripoiisi-somatos/galaktomata-somatos/christialen-emulsion-enudatiko-galaktwma-swmatos-100/
Frezyderm Elastin Refill Cream Booster 5ml;7,47;12,50;Προϊόν Frezyderm — FREZYDERM Elastin Refill Cream Booster 5ml;Διάφορα;5202888273018;;;
Frezyderm Neck Contour Cream;25,12;37,75;Ανακαλύψτε τη κρέμα σύσφιξης λαιμού NECK CONTOUR CREAM της FREZYDERM . Ενυδατώνει και ανορθώνει το χαλαρό δέρμα. Μπείτε στο site και δείτε περισσότερα!;Περιποίηση Προσώπου;5202888271199;;frezyderm/neck-contour-cream-5202888271199.jpg;https://www.frezyderm.gr/proionta-peripoiisis-prosopou/kremes-prosopou/antigirantikes-kremes/krema-susfiksis-laimou/
Frezyderm Abd Reform Skin Tensioner Cream Gel;15,92;26,65;Κρέμα-τζελ που επαναφέρει την ελαστικότητα και την αρχική όψη του δέρματος μετά από περιόδους έντονης χαλάρωσης. Είναι ιδανική για χρήση σε κοιλιά,...;Εγκυμοσύνη;5202888227394;;frezyderm/abd-reform-skin-tensioner-cream-gel-5202888227394.jpg;https://www.frezyderm.gr/proionta-egkumosunhs/kremes-susfikshs-gia-egkuous/abd-reform-skin-tensioner-cream-gel-krema-sisfiksis-somatos/
Frezyderm Ac-Norm Active Cleanser;11,55;19,34;Ανακαλύψτε το απαλό υγρό καθαρισμού προσώπου AC-NORM ACTIVE CLEANSER της FREZYDERM για το λιπαρό δέρμα με τάση ακμής. Μπείτε στο site και δείτε περισσότερα!;Περιποίηση Προσώπου;5202888228117;;frezyderm/ac-norm-active-cleanser-5202888228117.jpg;https://www.frezyderm.gr/proionta-peripoiisis-prosopou/proionta-katharismou-liparou-dermatos-me-tash-akmhs/ac-norm-active-cleanser-apalo-ygro-katharismou-proswpou/
Frezyderm Ac-Norm Active Cleanser;10,34;14,80;Ανακαλύψτε το απαλό υγρό καθαρισμού προσώπου AC-NORM ACTIVE CLEANSER της FREZYDERM για το λιπαρό δέρμα με τάση ακμής. Μπείτε στο site και δείτε περισσότερα!;Περιποίηση Προσώπου;5202888228377;;frezyderm/ac-norm-active-cleanser-5202888228377.jpg;https://www.frezyderm.gr/proionta-peripoiisis-prosopou/proionta-katharismou-liparou-dermatos-me-tash-akmhs/ac-norm-active-cleanser-apalo-ygro-katharismou-proswpou/
Frezyderm Ac-Norm Active Foam Plus;11,50;16,50;Ανακαλύψτε τον αφρό καθαρισμού προσώπου AC-NORM ACTIVE FOAM PLUS της FREZYDERM για λιπαρό δέρμα με τάση ακμής. Μπείτε στο site και δείτε περισσότερα!;Περιποίηση Προσώπου;5202888228384;5202888229384;frezyderm/ac-norm-active-foam-plus-5202888228384.jpg;https://www.frezyderm.gr/proionta-peripoiisis-prosopou/proionta-katharismou-liparou-dermatos-me-tash-akmhs/ac-norm-active-foam-plus-afros-katharismou-proswpou/
Frezyderm Ac-Norm Active Foam Plus;11,80;19,75;Ανακαλύψτε τον αφρό καθαρισμού προσώπου AC-NORM ACTIVE FOAM PLUS της FREZYDERM για λιπαρό δέρμα με τάση ακμής. Μπείτε στο site και δείτε περισσότερα!;Περιποίηση Προσώπου;5202888228445;;frezyderm/ac-norm-active-foam-plus-5202888228445.jpg;https://www.frezyderm.gr/proionta-peripoiisis-prosopou/proionta-katharismou-liparou-dermatos-me-tash-akmhs/ac-norm-active-foam-plus-afros-katharismou-proswpou/
Frezyderm Ac-Norm Aquatic Serum;10,56;17,67;Ενυδατικός oil-free ορός για την περιποίηση του υπό φαρμακευτική αγωγή δέρματος. Προσφέρει δυναμική ενυδάτωση, μειώνει τη δερματική δυσανεξία και τις ευαισθησίες και προσδίδει ματ όψη. Είναι ιδανικό και ως after-shave gel.Δερματολογικά Ελεγμένο;Περιποίηση Προσώπου;5202888228070;;frezyderm/ac-norm-aquatic-serum-5202888228070.jpg;https://www.frezyderm.gr/proionta-peripoiisis-prosopou/kremes-gia-liparo-derma-me-tash-akmhs/ac-norm-aquatic-serum-enydatikos-oil-free-oros-proswpou/
Frezyderm Ac-Norm Aquatic Serum;12,42;20,80;Ενυδατικός oil-free ορός για την περιποίηση του υπό φαρμακευτική αγωγή δέρματος. Προσφέρει δυναμική ενυδάτωση, μειώνει τη δερματική δυσανεξία και τις ευαισθησίες και προσδίδει ματ όψη. Είναι ιδανικό και ως after-shave gel.Δερματολογικά Ελεγμένο;Περιποίηση Προσώπου;5202888228452;;frezyderm/ac-norm-aquatic-serum-5202888228452.jpg;https://www.frezyderm.gr/proionta-peripoiisis-prosopou/kremes-gia-liparo-derma-me-tash-akmhs/ac-norm-aquatic-serum-enydatikos-oil-free-oros-proswpou/
Frezyderm Ac-Norm Aquatic Serum;14,50;24,27;Ενυδατικός oil-free ορός για την περιποίηση του υπό φαρμακευτική αγωγή δέρματος. Προσφέρει δυναμική ενυδάτωση, μειώνει τη δερματική δυσανεξία και τις ευαισθησίες και προσδίδει ματ όψη. Είναι ιδανικό και ως after-shave gel.Δερματολογικά Ελεγμένο;Περιποίηση Προσώπου;5202888228421;;frezyderm/ac-norm-aquatic-serum-5202888228421.jpg;https://www.frezyderm.gr/proionta-peripoiisis-prosopou/kremes-gia-liparo-derma-me-tash-akmhs/ac-norm-aquatic-serum-enydatikos-oil-free-oros-proswpou/
Frezyderm Acnorm Baby 40ml | Pharm24.gr;9,96;16,70;Frezyderm Acnorm Baby 40ml - Απαλή Κρέμα για την Ανακούφιση της Νεογνικής, Βρεφικής & Παιδικής Ακμής σε προσφορά στο Pharm24.gr. Δωρεάν μεταφορικά σε αγορές άνω των 69€ για μέλη.;Διάφορα;5202888221224;;frezyderm/acnorm-baby-40ml-pharm24-gr-5202888221224.jpg;https://www.pharm24.gr/frezyderm-acnorm-baby-40ml-p-8307.html
Frezyderm Ac-Norm Hydra Screen Spf 15;14,20;23,77;"Ενυδατική, αντηλιακή, κρέμα για το λιπαρό, με ατέλειες δέρμα, κατάλληλη σε περιόδους χαμηλής ηλιοφάνειας.&amp;nbsp;Ενυδατώνει σε βάθος, παρέχει αντηλιακή προστασία και προστατεύει από τους περιβαλλοντικούς ρύπους. Δερματολογικά Ελεγμένο";Περιποίηση Προσώπου;5202888102097;;frezyderm/ac-norm-hydra-screen-spf-15-5202888102097.jpg;https://www.frezyderm.gr/proionta-peripoiisis-prosopou/kremes-gia-liparo-derma-me-tash-akmhs/ac-norm-hydra-screen-spf-15-enydatikh-anthliakh-krema/
Frezyderm Ac-Norm Lip Balm Spf 15;5,99;10,00;Ενυδατικό Balm με άνυδρη σύνθεση για την καθημερινή περιποίηση των χειλιών και την ανακούφιση της χειλίτιδας από φαρμακευτικές αγωγές. Ενυδατώνει, ανακουφίζει και αποκαθιστά τα σκασμένα χείλη, παρέχει ηλιοπροστασία, έχει αναπλαστική δράση και μειώνει τη δερματική δυσανεξία. Δερματολογικά Ελεγμένο;Περιποίηση Προσώπου;5202888228476;;frezyderm/ac-norm-lip-balm-spf-15-5202888228476.jpg;https://www.frezyderm.gr/proionta-peripoiisis-prosopou/kremes-gia-liparo-derma-me-tash-akmhs/ac-norm-lip-balm-spf-15-enydatiko-balm-xeiliwn/
Frezyderm Ac-Norm Medilike Effect 1 Cream;14,21;23,80;Ανακαλύψτε το AC-NORM MEDILIKE EFFECT 1 CREAM, μία εξειδικευμένη κρέμα συμπτωμάτων ήπιας ακμής της FREZYDERM. Μπείτε τώρα στο site και δείτε περισσότερα!;Περιποίηση Προσώπου;5202888228322;;frezyderm/ac-norm-medilike-effect-1-cream-5202888228322.jpg;https://www.frezyderm.gr/proionta-peripoiisis-prosopou/kremes-gia-akmh/ac-norm-medilike-effect-1-cream-symptwmata-akmhs/
Frezyderm Ac-Norm Medilike Effect 1 Cream;15,26;25,55;Ανακαλύψτε το AC-NORM MEDILIKE EFFECT 1 CREAM, μία εξειδικευμένη κρέμα συμπτωμάτων ήπιας ακμής της FREZYDERM. Μπείτε τώρα στο site και δείτε περισσότερα!;Περιποίηση Προσώπου;5202888228315;;frezyderm/ac-norm-medilike-effect-1-cream-5202888228315.jpg;https://www.frezyderm.gr/proionta-peripoiisis-prosopou/kremes-gia-akmh/ac-norm-medilike-effect-1-cream-symptwmata-akmhs/
Frezyderm Ac-Norm Medilike Effect 1 Cream;16,33;27,34;Ανακαλύψτε το AC-NORM MEDILIKE EFFECT 1 CREAM, μία εξειδικευμένη κρέμα συμπτωμάτων ήπιας ακμής της FREZYDERM. Μπείτε τώρα στο site και δείτε περισσότερα!;Περιποίηση Προσώπου;5202888228308;;frezyderm/ac-norm-medilike-effect-1-cream-5202888228308.jpg;https://www.frezyderm.gr/proionta-peripoiisis-prosopou/kremes-gia-akmh/ac-norm-medilike-effect-1-cream-symptwmata-akmhs/
Frezyderm Ac-Norm Micellar Water;8,10;13,56;"Υδατικό διάλυμα με αντιερεθιστικά συστατικά που αποκαθιστά τη δερματική ευεξία στο ταλαιπωρημένο δέρμα. Αφαιρεί αποτελεσματικά το σμήγμα και τα υπολείμματα των φαρμακευτικών προϊόντων, προσφέρει ενισχυμένη κερατολυτική δράση, μειώνει τη δερματική δυσανεξία και την αίσθηση &#171;τραβήγματος&#187;.Δερματολογικά Ελεγμένο";Περιποίηση Προσώπου;5202888228346;;frezyderm/ac-norm-micellar-water-5202888228346.jpg;https://www.frezyderm.gr/proionta-peripoiisis-prosopou/proionta-katharismou-liparou-dermatos-me-tash-akmhs/ac-norm-micellar-water-calming-lotion/
Frezyderm Ac-Norm Normalizing Lotion;13,24;22,20;Εξισορροπιστική και ρυθμιστική λοσιόν για την περιποίηση του λιπαρού και με τάση ακμής δέρματος. Ολοκληρώνει τον καθαρισμό, μειώνει τη λιπαρότητα και συσφίγγει τους πόρους, παρέχει σμηγματορρυθμιστική δράση και μειώνει τη δερματική δυσανεξία. Δερματολογικά Ελεγμένο;Περιποίηση Προσώπου;5202888228339;;frezyderm/ac-norm-normalizing-lotion-5202888228339.jpg;https://www.frezyderm.gr/proionta-peripoiisis-prosopou/proionta-katharismou-liparou-dermatos-me-tash-akmhs/ac-norm-normalizing-lotion-proswpou/
Frezyderm Ac-Norm Peeling Gel;11,55;19,34;Gel απολέπισης για την αποσυμφόρηση των πόρων και τη λείανση του λιπαρού, με τάση ακμής δέρματος. Οι κόκκοι Jojoba που περιέχει έχουν ένα καινοτόμο περίβλημα που τους προσδίδει ένα απόλυτα σφαιρικό σχήμα, έτσι ώστε να μην τραυματίζεται από τις αιχμές των κόκκων ακόμη και το ευαίσθητο δέρμα. Προσφέρει βαθύ καθαρισμό, απομακρύνει το σμήγμα και τα μαύρα στίγματα, παρέχει βακτηριακή προστασία, αναζωογονεί και ενυδατώνει την επιδερμίδαΔερματολογικά ΕλεγμένοΔείτε εδώ πως να κάνετε απολέπιση στη λιπαρή επιδερμίδα με τάση ακμής!;Περιποίηση Προσώπου;5202888228094;;frezyderm/ac-norm-peeling-gel-5202888228094.jpg;https://www.frezyderm.gr/proionta-peripoiisis-prosopou/proionta-katharismou-liparou-dermatos-me-tash-akmhs/ac-norm-peeling-gel-apolepishs-proswpou/
Frezyderm Ac-Norm Peeling Gel;10,00;16,74;Gel απολέπισης για την αποσυμφόρηση των πόρων και τη λείανση του λιπαρού, με τάση ακμής δέρματος. Οι κόκκοι Jojoba που περιέχει έχουν ένα καινοτόμο περίβλημα που τους προσδίδει ένα απόλυτα σφαιρικό σχήμα, έτσι ώστε να μην τραυματίζεται από τις αιχμές των κόκκων ακόμη και το ευαίσθητο δέρμα. Προσφέρει βαθύ καθαρισμό, απομακρύνει το σμήγμα και τα μαύρα στίγματα, παρέχει βακτηριακή προστασία, αναζωογονεί και ενυδατώνει την επιδερμίδαΔερματολογικά ΕλεγμένοΔείτε εδώ πως να κάνετε απολέπιση στη λιπαρή επιδερμίδα με τάση ακμής!;Περιποίηση Προσώπου;5202888228353;;frezyderm/ac-norm-peeling-gel-5202888228353.jpg;https://www.frezyderm.gr/proionta-peripoiisis-prosopou/proionta-katharismou-liparou-dermatos-me-tash-akmhs/ac-norm-peeling-gel-apolepishs-proswpou/
Frezyderm Ac-Norm Peel-Off Mask;11,88;19,89;"Μάσκα καθαρισμού που απομακρύνει σμήγμα, νεκρά κύτταρα και μαύρα στίγματα, συσφίγγει τους πόρους και προσδίδει ματ όψη. Δερματολογικά Ελεγμένο&amp;nbsp;Μάσκα καθαρισμού προσώπου";Περιποίηση Προσώπου;5202888228360;;frezyderm/ac-norm-peel-off-mask-5202888228360.jpg;https://www.frezyderm.gr/proionta-peripoiisis-prosopou/proionta-katharismou-liparou-dermatos-me-tash-akmhs/proionta-peripoiisis-prosopouproionta-katharismou-liparou-dermatos-me-tash-akmhsac-norm-micellar-water-calming-lotion/
Frezyderm Ac-Norm Seb Adsorb Cream;13,89;23,30;Εξειδικευμένη κρέμα κατά της γυαλάδας που προσφέρει άμεση προσρόφηση και ρύθμιση της λιπαρότητας του δέρματος. Προσροφά το περίσσιο σμήγμα, προσφέρει σμίκρυνση των πόρων, ενυδατώνει και προσδίδει ματ όψη (primer). Είναι ιδανική για την ανδρική επιδερμίδα.Δερματολογικά Ελεγμένο;Περιποίηση Προσώπου;5202888228407;;frezyderm/ac-norm-seb-adsorb-cream-5202888228407.jpg;https://www.frezyderm.gr/proionta-peripoiisis-prosopou/kremes-gia-liparo-derma-me-tash-akmhs/ac-norm-seb-adsorb-cream-ekseidikeymenh-krema-proswpou/
Frezyderm Ac-Norm Spot Care;7,98;13,36;Έγχρωμο τζελ ταχείας δράσης για εφαρμογή πάνω στα σπυράκια. Προσφέρει απολέπιση και διάνοιξη του πόρου, παρέχει βακτηριακή προστασία, ρυθμίζει την έκκριση σμήγματος και καλύπτει τις κοκκινίλες και τις δυσχρωμίες. Δερματολογικά Ελεγμένο;Περιποίηση Προσώπου;5202888228469;;frezyderm/ac-norm-spot-care-5202888228469.jpg;https://www.frezyderm.gr/proionta-peripoiisis-prosopou/kremes-gia-liparo-derma-me-tash-akmhs/ac-norm-spot-care-gia-efarmogh-panw-sta-spyrakia/
Frezyderm Ac-Norm Spot Care;7,50;12,55;Έγχρωμο τζελ ταχείας δράσης για εφαρμογή πάνω στα σπυράκια. Προσφέρει απολέπιση και διάνοιξη του πόρου, παρέχει βακτηριακή προστασία, ρυθμίζει την έκκριση σμήγματος και καλύπτει τις κοκκινίλες και τις δυσχρωμίες. Δερματολογικά Ελεγμένο;Περιποίηση Προσώπου;5202888102349;;frezyderm/ac-norm-spot-care-5202888102349.jpg;https://www.frezyderm.gr/proionta-peripoiisis-prosopou/kremes-gia-liparo-derma-me-tash-akmhs/ac-norm-spot-care-gia-efarmogh-panw-sta-spyrakia/
Frezyderm Ac-Norm Sun Screen Fluid ΜΑΤ Spf 50+;15,93;26,70;Ανακαλύψτε το Ac-Norm Sun Screen Fluid SPF 50+, ματ αντηλιακό για το λιπαρό με τάση ακμής δέρμα που προσφέρει υψηλή προστασία χωρίς λιπαρότητα και γυαλάδα.;Αντηλιακά;5202888400025;;frezyderm/ac-norm-sun-screen-fluid-spf-50-5202888400025.jpg;https://www.frezyderm.gr/adiliaka/adiliaka-prosopou/acnorm-sun-screen-fluid-mat-spf50-antiliako-gia-liparo-me-tasi-akmis-derma/
Frezyderm Ac-Norm Sun Screen Fluid Tinted ΜΑΤ Spf 50+;15,40;25,78;Ανακαλύψτε το AC-NORM Sun Screen Fluid Tinted SPF 50+, ματ αντηλιακό με χρώμα για λιπαρό, με τάση ακμής δέρμα που προσφέρει υψηλή προστασία και ομοιόμορφη κάλυψη χωρίς λιπαρότητα.;Αντηλιακά;5202888400131;;frezyderm/ac-norm-sun-screen-fluid-tinted-spf-50-5202888400131.jpg;https://www.frezyderm.gr/adiliaka/adiliaka-prosopou-me-xroma/acnorm-sun-screen-fluid-tinted-mat-spf50-antiliako-me-xroma/
Frezyderm Ac-Norm Active Foam Plus;14,38;25,50;Ανακαλύψτε τον αφρό καθαρισμού προσώπου AC-NORM ACTIVE FOAM PLUS της FREZYDERM για λιπαρό δέρμα με τάση ακμής. Μπείτε στο site και δείτε περισσότερα!;Περιποίηση Προσώπου;5202888228414;;frezyderm/ac-norm-active-foam-plus-5202888228414.jpg;https://www.frezyderm.gr/proionta-peripoiisis-prosopou/proionta-katharismou-liparou-dermatos-me-tash-akmhs/ac-norm-active-foam-plus-afros-katharismou-proswpou/
Frezyderm Ac-Norm Total Control Cream;13,30;22,30;"""Ανακαλύψτε την AC-NORM TOTAL CONTROL CREAM, μία κρέμα αντιμετώπισης συμπτωμάτων ακμής της FREZYDERM. Μπείτε στο site και δείτε περισσότερα!""";Περιποίηση Προσώπου;5202888228438;;frezyderm/ac-norm-total-control-cream-5202888228438.jpg;https://www.frezyderm.gr/proionta-peripoiisis-prosopou/kremes-gia-akmh/ac-norm-total-control-cream-symptwmata-akmhs/
Frezyderm Active Block Spf 25;14,50;24,27;Ανακαλύψτε την Active BLOCK SPF 25 αντιγηραντική κρέμα ημέρας της FREZYDERM. Μπείτε τώρα στο site και δείτε όσα προϊόντα ταιριάζουν με τις δικές σας ανάγκες!;Περιποίηση Προσώπου;5202888271120;;frezyderm/active-block-spf-25-5202888271120.jpg;https://www.frezyderm.gr/proionta-peripoiisis-prosopou/kremes-prosopou/antigirantikes-kremes/active-antigirantiki-krema/
Frezyderm Active Sun Screen Tinted Face Cream Spf50+ Ενεργή Έγχρωμη Αντηλιακή Κρέμα Υψηλής Προστασίας με Ειδική Μαύρη Χρώση 50ml | Pharm24.gr;15,94;26,69;Frezyderm Active Sun Screen Tinted Face Cream Spf50+ Ενεργή Έγχρωμη Αντηλιακή Κρέμα Υψηλής Προστασίας με Ειδική Μαύρη Χρώση 50ml σε προσφορά στο Pharm24.gr. Δωρεάν μεταφορικά σε αγορές άνω των 69€ για μέλη.;Διάφορα;5202888400100;;frezyderm/active-sun-screen-tinted-face-cream-spf50-50ml-pharm24-gr-5202888400100.jpg;https://www.pharm24.gr/frezyderm-active-sun-screen-tinted-face-cream-spf50-energh-egxrwmh-anthliakh-krema-ypshlhs-prostasias-me-eidikh-mayrh-xrwsh-50ml-p-25429.html
Frezyderm Active Sun Screen Face Foundation Spf 30;15,15;25,36;Ανακαλύψτε το Αντηλιακό Make-up ACTIVE SUN SCREEN FACE FOUNDATION SPF 30 της FREZYDERM που καλύπτει δερματικές ατέλειες & δυσχρωμίες. Μπείτε στο site!;Αντηλιακά;5202888400063;;frezyderm/active-sun-screen-face-foundation-spf-30-5202888400063.jpg;https://www.frezyderm.gr/adiliaka/adiliaka-prosopou-me-xroma/active-antiliako-make-up/
Frezyderm Active Sun Screen Sensitive Face - Body Spf 50;16,20;27,12;Ανακαλύψτε το ACTIVE SUN SCREEN SENSITIVE της FREZYDERM. Αντηλιακό για εγκύους & ευαίσθητο δέρμα μόνο με φυσικά φίλτρα. Μπείτε στο site & δείτε περισσότερα!;Αντηλιακά;5202888400056;;frezyderm/active-sun-screen-sensitive-face-body-spf-50-5202888400056.jpg;https://www.frezyderm.gr/adiliaka/adiliaka-prosopou/active-antiliako-gia-egkuous-kai-euaisthito-derma-me-energo-anthraka/
