Όνομα;Χονδρική τιμή (€);Λιανική τιμή (€);Περιγραφή;Κατηγορία;Barcode (EAN);Παραλλαγές (variants);Φωτογραφία;URL επίσημου site
Frezyderm Sun Screen On The Move Spf 50;11,46;19,20;Αντηλιακό spray προσώπου ταχείας εφαρμογής και πολλαπλής χρήσης (πόλη, παραλία κ.λπ.) με φωτοσταθερά φίλτρα ευρέoς φάσματος. Διαθέτει Τεχνολογία Super Fine Mist υψηλής προστασίας και Τεχνολογία On the Move για ταχύτατη εφαρμογή, ακόμα και εν κινήσει, ενώ χάρη στην αποκλειστική καινοτομία Hydro Cosmetic Technology προσφέρει οπτική βελτίωση των ρυτίδων και ματ όψη. Επιπλέον, ενυδατώνει την επιδερμίδα και ενισχύει τον δερματικό φραγμό -διαθέτοντας ωστόσο λεπτόρρευστη υφή- και με την εφαρμογή του στο δέρμα χαρίζει μία αίσθηση πούδρας. Είναι κατάλληλο για πρόσωπο και ευαίσθητα σημεία (αυτιά, σβέρκος), για πάνω από το μακιγιάζ και ψεκάζεται και στα μαλλιά, χωρίς να επηρεάζει το styling....;Αντηλιακά;5202888222443;;frezyderm/sun-screen-on-the-move-spf-50-5202888222443.jpg;https://www.frezyderm.gr/adiliaka/adiliaka-prosopou/sun-screen-on-the-move-spf-50-anthliako-spray-proswpou/
Frezyderm Sea Side Dry Mist Spf 50+;15,29;25,60;"Αντηλιακό dry oil σε μορφή mist που προσφέρει πολύ υψηλή προστασία. Έχει λεπτόρρευστη υφή που απλώνεται πολύ εύκολα και χάρη στη Wet Skin Formula είναι ιδανικό για εφαρμογή και σε βρεγμένο δέρμα, χωρίς να χρειάζεται να προηγηθεί σκούπισμα, ενώ η πρακτική βαλβίδα του προσφέρει ομοιόμορφο συνεχή ψεκασμό, για άριστη εφαρμογή. Προστατεύει από τη φωτογήρανση και τις ελεύθερες ρίζες που προκαλούνται από την UVR ακτινοβολία και καλύπτει τις ανάγκες πολύ υψηλής ηλιοπροστασίας όλης της οικογένεια, ενώ είναι ιδανικό για παιδιά και εφήβους. Σε καινοτόμο airless συσκευασία.Βραβευμένο με το βραβείο Prix De Beaute 2016 ως το καλύτερο προϊόν στην κατηγορία &#171;Δερμοκαλλυντικά: Αντηλιακή Προστασία&#187;.";Αντηλιακά;5202888222375;;frezyderm/sea-side-dry-mist-spf-50-5202888222375.jpg;https://www.frezyderm.gr/adiliaka/adiliaka-somatos/sea-side-antiliako-mist/
Frezyderm Seaweed Hydrogel Care Patch;13,63;22,82;"Ανακαλύψτε&#160;την&#160;μάσκα προσώπου&#160;Seaweed&#160;Hydrogel Care Patch,&#160;για&#160;εντατική&#160;φροντίδα προσώπου&#160;και αποτοξίνωση&#160;της&#160;επιδερμίδας. Μπείτε&#160;στο&#160;site&#160;της&#160;Frezyderm!";Περιποίηση Προσώπου;5202888262531;;frezyderm/seaweed-hydrogel-care-patch-5202888262531.jpg;https://www.frezyderm.gr/proionta-peripoiisis-prosopou/maskes-proswpou-eye-patches/seaweed-hydrogel-care-patch-maska-proswpou/
Frezyderm Seb Excess Shampoo;7,55;12,64;Απαλό σαμπουάν που ρυθμίζει και εξισορροπεί τη λιπαρότητα. Η δράση των φυτικών εκχυλισμάτων σε συνδυασμό με Σουλφοπεπτίδια και Capryloyl Glutamate προσφέρουν καθαρισμό σε βάθος, ενώ παράλληλα τονώνουν και προστατεύουν την τρίχα. Τα βαριά και άτονα μαλλιά αποκτούν και πάλι όγκο και λάμψη και το χτένισμα διατηρείται για μεγαλύτερο χρονικό διάστημα. Με ουδέτερο pH.ΜελέτεςΑποτελεσματικότηταςΑξιολόγησης ασφάλειας;Περιποίηση Μαλλιών;5202888105135;;frezyderm/seb-excess-shampoo-5202888105135.jpg;https://www.frezyderm.gr/peripoiisi-mallion/sampouan/lipara-mallia/seb-excess-shampoo-sampouan/
Frezyderm Seb Excess Shampoo;7,60;12,72;Απαλό σαμπουάν που ρυθμίζει και εξισορροπεί τη λιπαρότητα. Η δράση των φυτικών εκχυλισμάτων σε συνδυασμό με Σουλφοπεπτίδια και Capryloyl Glutamate προσφέρουν καθαρισμό σε βάθος, ενώ παράλληλα τονώνουν και προστατεύουν την τρίχα. Τα βαριά και άτονα μαλλιά αποκτούν και πάλι όγκο και λάμψη και το χτένισμα διατηρείται για μεγαλύτερο χρονικό διάστημα. Με ουδέτερο pH.ΜελέτεςΑποτελεσματικότηταςΑξιολόγησης ασφάλειας;Περιποίηση Μαλλιών;5202888105128;;frezyderm/seb-excess-shampoo-5202888105128.jpg;https://www.frezyderm.gr/peripoiisi-mallion/sampouan/lipara-mallia/seb-excess-shampoo-sampouan/
Frezyderm Sebum Control Shampoo;12,67;21,20;Απαλό σαμπουάν που λειτουργεί συνεργατικά με τη φαρμακευτική αγωγή και δρα αποτελεσματικά ενάντια στην σμηγματορροϊκή δερματίτιδα, την ψωρίαση, τον ερεθισμό και τον κνησμό του τριχωτού. Προστατεύει τη δερματική χλωρίδα του τριχωτού και καταπραΰνει την ερεθισμένη επιδερμίδα. Με Ουδέτερο pH.ΜελέτεςΑποτελεσματικότηταςΑξιολόγησης ασφάλειας;Περιποίηση Μαλλιών;5202888105098;;frezyderm/sebum-control-shampoo-5202888105098.jpg;https://www.frezyderm.gr/peripoiisi-mallion/sampouan/smigmatorroiki-dermatitida/sebum-control-shampoo-sampouan/
Frezyderm Sebum Control Shampoo;9,47;15,90;Απαλό σαμπουάν που λειτουργεί συνεργατικά με τη φαρμακευτική αγωγή και δρα αποτελεσματικά ενάντια στην σμηγματορροϊκή δερματίτιδα, την ψωρίαση, τον ερεθισμό και τον κνησμό του τριχωτού. Προστατεύει τη δερματική χλωρίδα του τριχωτού και καταπραΰνει την ερεθισμένη επιδερμίδα. Με Ουδέτερο pH.ΜελέτεςΑποτελεσματικότηταςΑξιολόγησης ασφάλειας;Περιποίηση Μαλλιών;5202888105081;;frezyderm/sebum-control-shampoo-5202888105081.jpg;https://www.frezyderm.gr/peripoiisi-mallion/sampouan/smigmatorroiki-dermatitida/sebum-control-shampoo-sampouan/
Frezyderm Self Care Gel 75ml;15,76;26,38;Προϊόν Frezyderm — FREZYDERM Self Care Gel 75ml;Διάφορα;5202888102158;5202888227332;frezyderm/dermofilia-hand-cream-75ml-40ml-5202888102158.jpg;
Frezyderm Self Care Gel Intim Lubricant Care;13,75;23,02;Ανακαλύψτε το λεπτόρρευστο διάφανο gel SELF CARE GEL περιποίησης της ευαίσθητης περιοχής που ανακουφίζει από ερεθισμούς και κνησμό. Μπείτε στο frezyderm.gr!;Ευαίσθητη Περιοχή;5202888227585;;frezyderm/self-care-gel-intim-lubricant-care-5202888227585.jpg;https://www.frezyderm.gr/peripoihsh-euaisthhths-perioxhs/eidikh-peripoihsh-euaisthhths-perioxhs/self-care-gel-gia-thn-peripoihsh-euaisthhths-perioxhs/
Frezyderm Self Tan Body Shape;16,00;26,78;Αυτομαυριστικό γαλάκτωμα με παράλληλη συσφικτική δράση. Περιέχει ένα σύμπλεγμα ενεργών συστατικών που δίνουν ένα φυσικό, ομοιόμορφο μαύρισμα στο δέρμα χωρίς έκθεση στον ήλιο ενώ το σύμπλεγμα φυτικών συστατικών ενεργοποιούν τη μελανίνη, ώστε να αποφεύγονται τα εγκαύματα κατά τις πρώτες ημέρες έκθεσης στον ήλιο. Ταυτόχρονα, ενυδατώνει την επιδερμίδα και παρέχει αντιοξειδωτική και αντιγηραντική προστασία. Απλώνεται εύκολα και απορροφάται άμεσα, χωρίς να αφήνει λιπαρότητα, γραμμές και κίτρινα χροιά. Παράλληλα, η εμπλουτισμένη του σύνθεση με φυτικά εκχυλίσματα, καφεΐνη και Guarana, προσφέρει σύσφιξη της επιδερμίδας, ενεργοποιεί τη λιπόλυση, αυξάνει την ελαστικότητα και το σφρίγος της...;Αντηλιακά;5202888222283;;frezyderm/self-tan-body-shape-5202888222283.jpg;https://www.frezyderm.gr/adiliaka/automauristiko/automauristiko-galaktwma/
Frezyderm Sensitive Kids Face & Body Milk 200ml | Pharm24.gr;9,53;15,95;Frezyderm Sensitive Kids Face & Body Milk 200ml - Απαλό Ενυδατικό Γαλάκτωμα για την Παιδική Επιδερμίδα Πρόσωπο & Σώμα σε προσφορά στο Pharm24.gr. Δωρεάν μεταφορικά σε αγορές άνω των 69€ για μέλη.;Διάφορα;5202888230042;;frezyderm/sensitive-kids-face-body-milk-200ml-pharm24-gr-5202888230042.jpg;https://www.pharm24.gr/frezyderm-sensitive-kids-face-body-milk-200ml-p-3644.html
Frezyderm Sensitive Kids Styling Gel Παιδικό Ζελέ Μαλλιών για Δυνατό Κράτημα, 100ml - oFarmakopoiosMou.gr;5,08;8,50;Παιδικό Ζελέ Μαλλιών για Δυνατό Κράτημα, θρέψη και τόνωση των μαλλιών.;Διάφορα;5202888230073;;frezyderm/sensitive-kids-styling-gel-100ml-ofarmakopoiosmou-gr-5202888230073.jpg;https://www.ofarmakopoiosmou.gr/frezyderm-sensitive-kids-styling-gel-paidiko-zele-mallion-gia-dynato-kratima-100ml
Frezyderm Sensiteeth Epismalto Toothpaste 1.450ppm;4,79;8,02;"Παιδική οδοντόκρεμα φυσικής επισμάλτωσης με Φθόριο 1.450 ppm και Ασβέστιο.&amp;nbsp;Ενισχύει φυσικά το σμάλτο των δοντιών και σταματά την καταστροφή τους από τα οξέα των τροφών και την τερηδόνα. Παράλληλα, προστατεύει από τα μικρόβια, τους ερεθισμούς των ούλων και τον στοματικό βλενογόννο. Με υπέροχο άρωμα φράουλας. Κλινικά ΕλεγμένηΔείτε στη Frezyland πώς να κάνετε το βούρτισμα των παιδιών σας, παιχνίδι!";Παιδική Περιποίηση;5202888230103;;frezyderm/sensiteeth-epismalto-toothpaste-1-450ppm-5202888230103.jpg;https://www.frezyderm.gr/proionta-paidikhs-peripoihshs/stomatikh-ugieinh/paidikes-odontokremes/sensiteeth-epismalto-toothpaste/
Frezyderm Sensiteeth First Toothpaste;3,39;5,70;Οδοντόκρεμα για την πρώτη οδοντοφυΐα, για βρέφη από 6 μηνών έως παιδιά 3 ετών. Η σύνθεση της απαλή και ασφαλή για τον στοματικό βλεννογόνο, προστατεύει τα πρώτα δοντάκια από την τερηδόνα και την δημιουργία πλάκας, και το στόμα από την ανάπτυξη μικροβίων, ενώ σέβεται τη φυσιολογία των ούλων. Με καταπληκτική γεύση βατόμουρου.Δείτε στη Frezyland συμβουλές για τον καθαρισμό των νεογιλών δοντιών!;Φροντίδα Μωρού;5202888230127;;frezyderm/sensiteeth-first-toothpaste-5202888230127.jpg;https://www.frezyderm.gr/frontida-mwrou/brefiki-stomatiki-ugieini/brefikes-odontokremes/sensiteeth-first-toothpaste-brefiki-odontokrema/
Frezyderm Sensiteeth Kids Aphthae Gel;7,01;11,73;Ανακαλύψτε το παιδικό τζελ για άφθες SENSITEETH KIDS APHTHAE GEL από την FREZYDERM. Μπείτε στο site και δείτε περισσότερα!;Παιδική Περιποίηση;5202888230134;;frezyderm/sensiteeth-kids-aphthae-gel-5202888230134.jpg;https://www.frezyderm.gr/proionta-paidikhs-peripoihshs/stomatikh-ugieinh/paidika-kataprauntika-gel-gia-afthes-stomatika-elkh/sensiteeth-kids-aphthae-gel-tzel-afthes/
Frezyderm Sensiteeth Kids Mouthwash;5,08;8,00;Στοματικό διάλυμα κατά της τερηδόνας, για παιδιά από 6 ετών με Φθόριο 250ppm και Ασβέστιο. Προστατεύει από την τερηδόνα, τα μικρόβια και τους ερεθισμούς των ούλων, ενισχύει το σμάλτο των δοντιών, εξασφαλίζει γερά δόντια χωρίς σφραγίσματα, και είναι ασφαλές για το στοματικό βλενογόννο. Με υπέροχη γεύση βατόμουρου.Κλινικά ΕλεγμένοΔείτε στη Frezyland πώς να κάνετε το βούρτισμα των παιδιών σας, παιχνίδι!;Παιδική Περιποίηση;5202888230080;;frezyderm/sensiteeth-kids-mouthwash-5202888230080.jpg;https://www.frezyderm.gr/proionta-paidikhs-peripoihshs/stomatikh-ugieinh/stomatika-dialumata-gia-paidia/sensiteeth-kids-stomatiko-dialuma-gia-paidia/
Frezyderm Sensiteeth Kids Mouthwash;3,50;5,86;Στοματικό διάλυμα κατά της τερηδόνας, για παιδιά από 6 ετών με Φθόριο 250ppm και Ασβέστιο. Προστατεύει από την τερηδόνα, τα μικρόβια και τους ερεθισμούς των ούλων, ενισχύει το σμάλτο των δοντιών, εξασφαλίζει γερά δόντια χωρίς σφραγίσματα, και είναι ασφαλές για το στοματικό βλενογόννο. Με υπέροχη γεύση βατόμουρου.Κλινικά ΕλεγμένοΔείτε στη Frezyland πώς να κάνετε το βούρτισμα των παιδιών σας, παιχνίδι!;Παιδική Περιποίηση;5202888230691;5202888230592;frezyderm/sensiteeth-kids-mouthwash-5202888230691.jpg;https://www.frezyderm.gr/proionta-paidikhs-peripoihshs/stomatikh-ugieinh/stomatika-dialumata-gia-paidia/sensiteeth-kids-stomatiko-dialuma-gia-paidia/
Frezyderm Sensiteeth Kids Toothpaste 500ppm;3,89;6,50;Παιδική οδοντόκρεμα, κατά της τερηδόνας, για τον καθημερινό καθαρισμό των δοντιών. Η σύνθεση της απαλή, και ασφαλή για τον στοματικό βλεννογόνο. Η συνεργική δράση Φθόριου 500ppm και Ασβεστίου, προστατεύει τα δοντάκια από την τερηδόνα και τα μικρόβια, ενισχύει το σμάλτο των δοντιών και εξασφαλίζει γερά δόντια. Με υπέροχη γεύση βατόμουρου.Κλινικά ΕλεγμένηΔείτε στη Frezyland πώς να κάνετε το βούρτισμα των παιδιών σας, παιχνίδι!;Παιδική Περιποίηση;5202888230097;;frezyderm/sensiteeth-kids-toothpaste-500ppm-5202888230097.jpg;https://www.frezyderm.gr/proionta-paidikhs-peripoihshs/stomatikh-ugieinh/paidikes-odontokremes/sensiteeth-kids-toothpaste-paidikh-odontokrema/
Frezyderm Sensiteeth First Toothpaste;2,98;5,00;Οδοντόκρεμα για την πρώτη οδοντοφυΐα, για βρέφη από 6 μηνών έως παιδιά 3 ετών. Η σύνθεση της απαλή και ασφαλή για τον στοματικό βλεννογόνο, προστατεύει τα πρώτα δοντάκια από την τερηδόνα και την δημιουργία πλάκας, και το στόμα από την ανάπτυξη μικροβίων, ενώ σέβεται τη φυσιολογία των ούλων. Με καταπληκτική γεύση βατόμουρου.Δείτε στη Frezyland συμβουλές για τον καθαρισμό των νεογιλών δοντιών!;Φροντίδα Μωρού;5202888230059;;frezyderm/sensiteeth-first-toothpaste-5202888230059.jpg;https://www.frezyderm.gr/frontida-mwrou/brefiki-stomatiki-ugieini/brefikes-odontokremes/sensiteeth-first-toothpaste-brefiki-odontokrema/
Frezyderm Sensitive Kids Intim Girl Foam;7,90;13,20;Αφρός καθαρισμού για την καθημερινή υγιεινή της ευαίσθητης περιοχής κατά τη νεογνική, παιδική και προεφηβική ηλικία. Με ειδική φόρμουλα που δεν επηρεάζει τη φυσιολογική χλωρίδα και ενισχύει την άμυνας της ευαίσθητης περιοχής. Συμβάλλει στη μείωση ερεθισμών και κακοσμίας. Είναι σε εύχρηστη μορφή έτοιμου αφρού, όπου δεν απαιτείται η χρήση σπόγγου και ξεβγάζεται εύκολα.Δερματολογικά ελεγμένοςΕπισκεφθείτε τη Frezyland, έναν κόσμο γεμάτο δραστήριες μαμάδες!;Παιδική Περιποίηση;5202888230158;;frezyderm/sensitive-kids-intim-girl-foam-5202888230158.jpg;https://www.frezyderm.gr/proionta-paidikhs-peripoihshs/afroloutra/sensitive-kids-afros-katharismou-euaisthhths-perioxhs/
Frezyderm Sensitive Kids Shampoo Girls;6,35;10,63;Εξειδικευμένο σαμπουάν για κορίτσια, το οποίο περιποιείται απαλά την ευαίσθητη και ερεθισμένη παιδική επιδερμίδα και αφήνει απαλά μαλλιά για εύκολο χτένισμα. Προσφέρει βαθύ καθαρισμό ενώ παράλληλα προστατεύει τη φυσιολογική δερματική χλωρίδα, ενισχύει το μικροβιολογικό φραγμό και καταπραΰνει υπάρχοντες ερεθισμούς. Ενυδατώνει και ενισχύει την ελαστικότητα της τρίχας και προσφέρει στα μαλλιά όγκο και λάμψη.Δημιουργεί πλούσιο αφρό που κάνει το λούσιμο “παιχνίδι” και ξεπλένεται πολύ εύκολα. Έχει ουδέτερο pH και δεν ερεθίζει τα μάτια!Επισκεφθείτε τη Frezyland, έναν κόσμο γεμάτο δραστήριες μαμάδες!;Παιδική Περιποίηση;5202888230066;;frezyderm/sensitive-kids-shampoo-girls-5202888230066.jpg;https://www.frezyderm.gr/proionta-paidikhs-peripoihshs/paidika-sampouan/sensitive-kids-paidiko-sampouan-gia-koritsia/
Frezyderm Sensitive Kids Shampoo Boys;6,60;11,05;Εξειδικευμένο σαμπουάν για αγόρια, το οποίο περιποιείται απαλά την ευαίσθητη και ερεθισμένη παιδική επιδερμίδα. Προσφέρει βαθύ καθαρισμό ενώ παράλληλα προστατεύει τη φυσιολογική δερματική χλωρίδα, ενισχύει το μικροβιολογικό φραγμό και καταπραΰνει υπάρχοντες ερεθισμούς. Ενυδατώνει και ενισχύει την ελαστικότητα της τρίχας και προσφέρει στα μαλλιά όγκο και λάμψη.Δημιουργεί πλούσιο αφρό που κάνει το λούσιμο “παιχνίδι” και ξεπλένεται πολύ εύκολα. Έχει ουδέτερο pH και δεν ερεθίζει τα μάτια!Επισκεφθείτε τη Frezyland, έναν κόσμο γεμάτο δραστήριες μαμάδες!;Παιδική Περιποίηση;5202888230011;;frezyderm/sensitive-kids-shampoo-boys-5202888230011.jpg;https://www.frezyderm.gr/proionta-paidikhs-peripoihshs/paidika-sampouan/sensitive-kids-paidiko-sampouan-gia-agoria/
Frezyderm Sensitive Kids Intim Girl Foam;7,09;11,87;Αφρός καθαρισμού για την καθημερινή υγιεινή της ευαίσθητης περιοχής κατά τη νεογνική, παιδική και προεφηβική ηλικία. Με ειδική φόρμουλα που δεν επηρεάζει τη φυσιολογική χλωρίδα και ενισχύει την άμυνας της ευαίσθητης περιοχής. Συμβάλλει στη μείωση ερεθισμών και κακοσμίας. Είναι σε εύχρηστη μορφή έτοιμου αφρού, όπου δεν απαιτείται η χρήση σπόγγου και ξεβγάζεται εύκολα.Δερματολογικά ελεγμένοςΕπισκεφθείτε τη Frezyland, έναν κόσμο γεμάτο δραστήριες μαμάδες!;Παιδική Περιποίηση;5202888230028;;frezyderm/sensitive-kids-intim-girl-foam-5202888230028.jpg;https://www.frezyderm.gr/proionta-paidikhs-peripoihshs/afroloutra/sensitive-kids-afros-katharismou-euaisthhths-perioxhs/
Frezyderm Sensitive Kids Shower Bath;7,09;9,44;Ενυδατικό αφρόλουτρο, το οποίο περιποιείται τη φυσιολογική, ευαίσθητη και ερεθισμένη παιδική επιδερμίδα. Καθαρίζει σε βάθος, καταπραΰνοντας από ερεθισμούς και φλεγμονές, ενώ παράλληλα προστατεύει τη φυσιολογική δερματική χλωρίδα, ενισχύει το μικροβιολογικό φραγμό και προσφέρει αντιοξειδωτική προστασία από τις ελεύθερες ρίζες και τις περιβαλλοντικές επιθέσεις. Δημιουργεί πλούσιο αφρό που κάνει το μπανάκι “παιχνίδι” και ξεπλένεται πολύ εύκολα.Έχει ουδέτερο pH και δεν ερεθίζει τα μάτια!Επισκεφθείτε τη Frezyland, έναν κόσμο γεμάτο δραστήριες μαμάδες!;Παιδική Περιποίηση;5202888230035;;frezyderm/sensitive-kids-shower-bath-5202888230035.jpg;https://www.frezyderm.gr/proionta-paidikhs-peripoihshs/afroloutra/sensitive-kids-shower-bath/
Frezyderm Sensitive Red Skin Facial Cream;14,80;24,78;Δείτε την κρέμα για ευαίσθητο δέρμα SENSITIVE RED SKIN FACIAL CREAM της FREZYDERM κατάλληλη για δέρμα με Ροδόχρους νόσο. Μπείτε τώρα στο site!;Περιποίηση Προσώπου;5202888271656;5202888271724;frezyderm/sensitive-red-skin-facial-cream-5202888271656.jpg;https://www.frezyderm.gr/proionta-peripoiisis-prosopou/kremes-prosopou/kremes-gia-eyaisthhto-derma/krema-gia-euaisthito-derma-rodoxrous-noso/
Frezyderm Sensitive Red Skin Tinted Spf 30 Cream;13,50;22,60;Δείτε την έγχρωμη κρέμα SENSITIVE RED SKIN TINTED SPF 30 CREAM για ευαίσθητο δέρμα της FREZYDERM. Μπείτε στο site και δείτε περισσότερα προϊόντα!;Περιποίηση Προσώπου;5202888271649;;frezyderm/sensitive-red-skin-tinted-spf-30-cream-5202888271649.jpg;https://www.frezyderm.gr/proionta-peripoiisis-prosopou/kremes-prosopou/kremes-gia-eyaisthhto-derma/egxrwmi-krema-gia-euaisthito-derma-rodoxrous-noso/
Frezyderm Skin Cleanser;11,88;15,14;Κλασσικό καθαριστικό προσώπου και σώματος με ήπια αντισηπτική δράση και μικροβιακή προστασία, σε υγρή μορφή. Περιέχει ήπια μαλακτικά, επιφανειοδραστικά, και ενυδατικά συστατικά τα οποία προσφέρουν αποτελεσματικό καθαρισμό και περιποίηση της επιδερμίδας.;Περιποίηση Προσώπου;5202888010026;;frezyderm/skin-cleanser-5202888010026.jpg;https://www.frezyderm.gr/proionta-peripoiisis-prosopou/katharismos-proswpou/katharistika-prosopou/katharistiko-prosopou-xeriwn-kai-swmatos/
