Όνομα;Χονδρική τιμή (€);Λιανική τιμή (€);Περιγραφή;Κατηγορία;Barcode (EAN);Παραλλαγές (variants);Φωτογραφία;URL επίσημου site
Frezyderm Baby Cologne;8,13;13,60;"Ενυδατική βρεφική κολόνια για τον καθημερινό αρωματισμό και την περιποίηση του μωρού. Είναι απόλυτα ασφαλής για το ευαίσθητο δερματάκι του, διότι περιέχει υδροάρωμα (Hydro Essentials) και όχι άρωμα διαλυτό σε αλκοόλη, ενώ σέβεται τη φυσιολογία του βρεφικού δέρματος γιατί έχει συμβατό pH.&amp;nbsp;Η προσεκτικά επιλεγμένη σύνθεσή του περιέχει εκχύλισμα χαμομηλιού για αντιφλογιστική και αντιερεθιστική δράση, αλλαντοΐνη που ελαχιστοποιεί τους ερεθισμούς και πανθενόλη που καταπραΰνει και προστατεύει το δέρμα.&amp;nbsp;Δερματολογικά ΕλεγμένηΕπισκεφθείτε τη Frezyland, έναν κόσμο γεμάτο δραστήριες μαμάδες!";Φροντίδα Μωρού;5202888102806;;frezyderm/baby-cologne-5202888102806.jpg;https://www.frezyderm.gr/frontida-mwrou/brefika-kalluntika/baby-cologne-brefiki-kolwnia/
Frezyderm Baby Cream 175ml | Pharm24.gr;10,10;16,91;Frezyderm Baby Cream 175ml - Απαλή, Προστατευτική Αδιάβροχη Κρέμα για την Αλλαγή της Πάνας σε προσφορά στο Pharm24.gr. Δωρεάν μεταφορικά σε αγορές άνω των 69€ για μέλη.;Διάφορα;5202888221187;;frezyderm/baby-cream-175ml-pharm24-gr-5202888221187.jpg;https://www.pharm24.gr/frezyderm-baby-cream-175ml-p-4214.html
Frezyderm Baby Cream 50ml | Pharm24.gr;7,06;11,82;Frezyderm Baby Cream 50ml - Απαλή, Προστατευτική, Αδιάβροχη Κρέμα για Βρέφη & Παιδιά σε προσφορά στο Pharm24.gr. Δωρεάν μεταφορικά σε αγορές άνω των 69€ για μέλη.;Διάφορα;5202888101076;;frezyderm/baby-cream-50ml-pharm24-gr-5202888101076.jpg;https://www.pharm24.gr/frezyderm-baby-cream-50ml-p-3849.html
Frezyderm Baby Foam 150ml | Pharm24.gr;8,99;15,00;Frezyderm Baby Foam 150ml - Απαλός Αφρός Καθαρισμού για το Βρεφικό & Παιδικό Δέρμα σε προσφορά στο Pharm24.gr. Δωρεάν μεταφορικά σε αγορές άνω των 69€ για μέλη.;Διάφορα;5202888101144;;frezyderm/baby-foam-150ml-pharm24-gr-5202888101144.jpg;https://www.pharm24.gr/frezyderm-baby-foam-150ml-p-1370.html
Frezyderm Baby Gums Gel;6,19;10,40;Ανακαλύψτε το τζελ για ούλα μωρών BABY GUMS GEL που προσφέρει άμεση ανακούφιση. Μπείτε στο site της FREZYDERM και μάθετε περισσότερα!;Φροντίδα Μωρού;5202888221170;;frezyderm/baby-gums-gel-5202888221170.jpg;https://www.frezyderm.gr/frontida-mwrou/brefiki-stomatiki-ugieini/tzel-gia-oyla-dontia-brefous/baby-gums-gel-tzel-gia-oula-mwrwn/
Frezyderm Baby Hydra Milk;10,25;17,20;Ενυδατικό γαλάκτωμα κατάλληλο για το ξηρό και ευαίσθητο δέρμα. Με φυσιολογικούς ενυδατικούς παράγοντες για πλούσια και σε βάθος ενυδάτωση του δέρματος. Περιποιείται και μαλακώνει το δερματάκι του μωρού και προλαμβάνει την αφυδάτωση και την ξηροδερμία. Εμπλουτισμένο με πρωτεΐνες σιταριού για την ενίσχυση του υδρολιπιδικού μανδύα, που αφήνει ένα λεπτό στρώμα υδρολιπιδικής ισορροπίας για την προστασία της επιδερμίδας από ερεθισμούς. Παράλληλα, περιέχει εκχύλισμα χαμομηλιού για αντιφλογιστική και αντιερεθιστική δράση και αντιφλογιστικά συστατικά με επουλωτικές και καταπραϋντικές ιδιότητες.Δερματολογικά ΕλεγμένοΝέα ΜΕΓΑΛΥΤΕΡΗ συσκευασία με πρακτική αντλίαΕπισκεφθείτε τη Frezyland για το πρώτο...;Φροντίδα Μωρού;5202888101090;;frezyderm/baby-hydra-milk-5202888101090.jpg;https://www.frezyderm.gr/frontida-mwrou/brefiko-galaktoma/baby-hydra-milk-brefiko-galaktwma/
Frezyderm Baby Liquid Talc;8,77;14,70;"Κρέμα talc για την περιποίηση της βρεφικής επιδερμίδας. Σε αντίθεση με τα κοινά talc σε σκόνη, εφαρμόζεται με ακρίβεια στην επιθυμητή περιοχή χωρίς να αιωρούνται κόκκοι πούδρας, που ενδεχομένως να επικαθίσουν στους πνεύμονες και να επιβαρύνουν το αναπνευστικό του βρέφους. Επιπλέον, αποφεύγεται η εισχώρηση των κόκκων στο ουροποιητικό σύστημα, κατά τη χρήση στην μηρογεννητική περιοχή, που μπορεί να προκαλέσει λοιμώξεις.&amp;nbsp;Περιέχει ταλκ φαρμακευτικής καθαρότητας που προσροφά την επιφανειακή υγρασία και αφήνει ένα λεπτό στρώμα προστασίας της επιδερμίδας από την επαφή με ερεθιστικούς παράγοντες. Είναι εμπλουτισμένο με εκχύλισμα χαμομηλιού και χαμομηλέλαιο για επούλωση και ανακούφιση...";Φροντίδα Μωρού;5202888101106;;frezyderm/baby-liquid-talc-5202888101106.jpg;https://www.frezyderm.gr/frontida-mwrou/brefika-kalluntika/baby-liquid-talc-krema-talc/
Frezyderm Baby Oil;8,77;14,70;Ελαφρά αρωματισμένο μαλακτικό λάδι, κατάλληλο για βρέφη, παιδιά και ενήλικες. Είναι ιδανικό για την καθημερινή περιποίηση και το μασάζ της βρεφικής επιδερμίδας. Προσφέρει προστασία και ανακούφιση από τους ερεθισμούς και τα συγκάματα χάρη στο χαμομηλέλαιο που περιέχει, ενώ παράλληλα σέβεται τη φυσιολογία του βρεφικού δέρματος και το προστατεύει από την αυξημένη διαδερμική απώλεια ύδατος και την αφυδάτωση. Η επιδερμίδα γίνεται μεταξένια και απαλή. Είναι λεπτόρρευστο και απορροφάται άμεσα, χωρίς να αφήνει καθόλου ίχνη λιπαρότητας.Δερματολογικά ΕλεγμένοΔείτε στη Frezyland πως να χαλαρώσετε το μωρό σας για έναν αποτελεσματικό ύπνο.;Φροντίδα Μωρού;5202888101113;;frezyderm/baby-oil-5202888101113.jpg;https://www.frezyderm.gr/frontida-mwrou/brefika-kalluntika/baby-oil-brefiko-ladi-masaz/
Frezyderm Baby Perioral ΟΙΝΤΜΕΝΤ;10,48;16,70;Ανακαλύψτε το βρεφικό καλλυντικό BABY PERIORAL CREAM για την περιποίηση της ρινοστοματικής περιοχής. Μπείτε στο site της FREZYDERM και μάθετε περισσότερα!;Φροντίδα Μωρού;5202888221194;;frezyderm/baby-perioral-5202888221194.jpg;https://www.frezyderm.gr/frontida-mwrou/brefiki-stomatiki-ugieini/baby-perioral-cream-brefiko-kalluntiko/
Frezyderm Baby Perioral ΟΙΝΤΜΕΝΤ;10,48;17,54;Ανακαλύψτε το βρεφικό καλλυντικό BABY PERIORAL CREAM για την περιποίηση της ρινοστοματικής περιοχής. Μπείτε στο site της FREZYDERM και μάθετε περισσότερα!;Φροντίδα Μωρού;5202888238000;;frezyderm/baby-perioral-5202888238000.jpg;https://www.frezyderm.gr/frontida-mwrou/brefiki-stomatiki-ugieini/baby-perioral-cream-brefiko-kalluntiko/
Frezyderm Baby Shampoo 200ml;7,95;13,31;Προϊόν Frezyderm — FREZYDERM Baby Shampoo 200ml;Διάφορα;5202888101069;;;
Frezyderm Baby Shampoo, 300ml - Online Pharmacy Ofarmakopoiosmou.gr;8,77;14,70;An extra-gentle, anti-irritant & moisturising daily shampoo for babies.;Διάφορα;5202888221248;;frezyderm/baby-shampoo-300ml-online-pharmacy-ofarmakopoiosmou-gr-5202888221248.png;https://www.ofarmakopoiosmou.gr/en/frezyderm-baby-shampoo-300ml
Frezyderm Baby Sun Care Spf 25;13,09;25,60;"Αντηλιακό γαλάκτωμα προσώπου και σώματος για βρέφη, μόνο με φυσικά φίλτρα. Έχει σύνθεση εμπλουτισμένη με Βιταμίνη Ε και Πανθενόλη και είναι ειδικά σχεδιασμένη για να σέβεται τη φυσιολογία του ευαίσθητου βρεφικού δέρματος. Παράλληλα, θωρακίζει το DNA των κυττάρων του δέρματος και παρέχει προστασία από τις ελεύθερες ρίζες που προκαλούνται από εξωγενείς παράγοντες, όπως ο ήλιος και η ατμοσφαιρική ρύπανση. &amp;nbsp;Είναι ανθεκτικό στο νερό και είναι ιδανικό για βρέφη και παιδιά, καθώς και για άτομα με ατοπική προδιάθεση ή/και δυσανεκτικά στα οργανικά φίλτρα.Επισκεφθείτε τη Frezyland, έναν κόσμο γεμάτο δραστήριες μαμάδες!";Φροντίδα Μωρού;5202888221262;;frezyderm/baby-sun-care-spf-25-5202888221262.jpg;https://www.frezyderm.gr/frontida-mwrou/brefika-antiliaka/baby-sun-care-spf-25-brefiko-antiliako/
Frezyderm Baby Sun Care Spf 25;11,42;19,11;"Αντηλιακό γαλάκτωμα προσώπου και σώματος για βρέφη, μόνο με φυσικά φίλτρα. Έχει σύνθεση εμπλουτισμένη με Βιταμίνη Ε και Πανθενόλη και είναι ειδικά σχεδιασμένη για να σέβεται τη φυσιολογία του ευαίσθητου βρεφικού δέρματος. Παράλληλα, θωρακίζει το DNA των κυττάρων του δέρματος και παρέχει προστασία από τις ελεύθερες ρίζες που προκαλούνται από εξωγενείς παράγοντες, όπως ο ήλιος και η ατμοσφαιρική ρύπανση. &amp;nbsp;Είναι ανθεκτικό στο νερό και είναι ιδανικό για βρέφη και παιδιά, καθώς και για άτομα με ατοπική προδιάθεση ή/και δυσανεκτικά στα οργανικά φίλτρα.Επισκεφθείτε τη Frezyland, έναν κόσμο γεμάτο δραστήριες μαμάδες!";Φροντίδα Μωρού;5202888102363;;frezyderm/baby-sun-care-spf-25-5202888102363.jpg;https://www.frezyderm.gr/frontida-mwrou/brefika-antiliaka/baby-sun-care-spf-25-brefiko-antiliako/
Frezyderm Anti-Thermal Spring Sea Water Mist;12,00;20,09;"Καταπραϋντικό νερό που δροσίζει άμεσα την καταπονημένη από τον ήλιο επιδερμίδα. Η ανανεωμένη σύνθεσή του είναι εμπλουτισμένη με Spring Sea Water που αντλείται από τη γαλλική Βρετάνη. Διαθέτει ισχυρές αντιγηραντικές ιδιότητες και προσφέρει αποτελεσματική ενυδάτωση &amp;nbsp;ενώ παράλληλα προστατεύει το δέρμα από το οξειδωτικό stress. Ταυτόχρονα, ενισχύει το δερματικό φραγμό ο οποίος αποδυναμώνεται από την αύξηση της θερμοκρασίας και την υπερβολική έκθεση στον ήλιο ενώ παρέχει προστασία των δερματικών κυττάρων. Ενισχύει το δίκτυο κολλαγόνου και την ελαστίνη, προστατεύει την επιδερμίδα από τις ελεύθερες ρίζες ενώ μειώνει τα ορατά σημεία φωτογήρανσης. Σε καινοτόμο airless συσκευασία με...";Αντηλιακά;5202888222382;;frezyderm/anti-thermal-spring-sea-water-mist-5202888222382.jpg;https://www.frezyderm.gr/adiliaka/sprei-nerou/sprei-nerou-gia-ton-ilio/
Frezyderm Periodontitis Chlorhexene 0,2% Gel 30ml | Pharm24.gr;4,82;8,06;Frezyderm Periodontitis Chlorhexene 0,2% Gel 30ml - Ζελ Τοπικής Χρήσης για Αντιμετώπιση των Συμπτωμάτων Περιοδοντίτιδας και Ουλίτιδας σε προσφορά στο Pharm24.gr. Δωρεάν μεταφορικά σε αγορές άνω των 69€ για μέλη.;Διάφορα;5202888281082;;frezyderm/periodontitis-chlorhexene-0-2-gel-30ml-pharm24-gr-5202888281082.jpg;https://www.pharm24.gr/frezyderm-periodontitis-chlorhexene-02-gel-30ml-p-11383.html
Frezyderm Chlorhexene Pro Mouthwash;6,94;11,62;Ανακαλύψτε το στοματικό διάλυμα CHLORHEXENE PRO MOUTHWASH για επικουρική αντιμετώπιση των προβλημάτων των ούλων. Μπείτε στο site της FREZYDERM!;Στοματική Υγιεινή;5202888282041;;frezyderm/chlorhexene-pro-mouthwash-5202888282041.jpg;https://www.frezyderm.gr/proionta-gia-th-stomatikh-ygieinh/proionta-stomatikhs-ygieinhs-gia-enhlikes/prostasia-apo-thn-periodontitida/chlorhexene-pro-mouthwash-stomatiko-dialyma/
Frezyderm Christialen Emulsion;17,55;26,90;Ενυδατικό γαλάκτωμα σώματος για την καθημερινή περιποίηση και θρέψη του δέρματος. Ενυδατώνει άμεσα και σε βάθος την επιδερμίδα σας, αποκαθιστώντας το υδατικό ισοζύγιο, ενώ παράλληλα αποτελεί μια ασπίδα προστασίας από δυσμενείς περιβαλλοντικές συνθήκες. Με δροσερή λεπτόρρευστη και μη λιπαρή υφή που δεν αφήνει ίχνη λιπαρότητας και σας επιτρέπει να ντυθείτε αμέσως. Απλώστε το στην επιδερμίδα σας μετά το ντους και ζήστε την εμπειρία της μεταξένιας επιδερμίδας.Δερματολογικά Ελεγμένο;Περιποίηση Σώματος;5202888271106;;frezyderm/christialen-emulsion-5202888271106.jpg;https://www.frezyderm.gr/peripoiisi-somatos/galaktomata-somatos/christialen-emulsion-enudatiko-galaktwma-swmatos-100/
Frezyderm Frezymar Cleaner Hypertonic Strong;6,96;11,65;Ανακαλύψτε το ρινικό αποσυμφορητικό βρέφους, FREZYMAR CLEANER HYPERTONIC STRONG. Μπείτε στο site της FREZYDERM και δείτε περισσότερα!;Αποσυμφορητικά Μύτης;5202888106149;;frezyderm/frezymar-cleaner-hypertonic-strong-5202888106149.jpg;https://www.frezyderm.gr/aposumforitika-mutis/rinika-sprei/frezymar-cleaner-riniko-aposumforhtiko-strong/
Frezyderm Baby Coli Sleep Massage Gel;9,08;13,60;Ανακαλύψτε το καλλυντικό για κολικούς μωρού BABY COLI SLEEP MASSAGE GEL που ανακουφίζει τους κολικούς του μωρού. Μπείτε στο site της FREZYDERM για περισσότερα!;Φροντίδα Μωρού;5202888221231;5202888238017;frezyderm/baby-coli-sleep-massage-gel-5202888221231.jpg;https://www.frezyderm.gr/frontida-mwrou/brefika-kalluntika/colic-relief-massage-gel-iga-kolikous-mwrou/
Frezyderm Color Eye Balm;14,52;26,40;Ανακαλύψτε την έγχρωμη κρέμα ματιών COLOR EYE BALM της FREZYDERM. Καταπολεμά τους μαύρους κύκλους και τις σακούλες στα μάτια. Μπείτε τώρα στο site!;Περιποίηση Προσώπου;5202888271670;5202888271070;frezyderm/color-eye-balm-5202888271670.jpg;https://www.frezyderm.gr/proionta-peripoiisis-prosopou/proionta-peripoihshs-matiwn/egxrwmi-krema-gia-sakoules-sta-matia/
Frezyderm Color Protect Shampoo 200ml;8,12;12,72;Προϊόν Frezyderm — FREZYDERM Color Protect Shampoo 200ml;Διάφορα;5202888105142;;;
Frezyderm Color Protect Spray 100ml;7,26;12,15;Προϊόν Frezyderm — FREZYDERM Color Protect Spray 100ml;Διάφορα;5202888105159;;frezyderm/baby-sun-care-spf-50-100ml-50ml-5202888105159.jpg;
Frezyderm Up Confidence Bust Recovery Cream Gel;14,10;23,60;Κρέμα-τζελ που επαναφέρει τον όγκο και το σχήμα του στήθους και των γλουτών, μετά από εγκυμοσύνη, θηλασμό ή παρατεταμένη δίαιτα, ιδανική για το πεσ...;Περιποίηση Σώματος;5202888227240;;frezyderm/up-confidence-bust-recovery-cream-gel-5202888227240.jpg;https://www.frezyderm.gr/peripoiisi-somatos/krema-anorthosis-stithous/confidence-up-bust-recovery-cream-gel-krema-anorthwshs-sththous/
Frezyderm Cough Syrup Adults;8,40;14,05;Ανακαλύψτε το COUGH SYRUP ADULTS σιρόπι κατάλληλο για ενήλικες και ανακουφιστείτε από τον ξηρό και παραγωγικό βήχα. Μπείτε στη Frezyderm και δείτε περισσότερα!;Σιρόπια για τον Βήχα;5202888331008;;frezyderm/cough-syrup-adults-5202888331008.jpg;https://www.frezyderm.gr/siropia-gia-ton-bhxa/cough-syrup-adults-siropi-gia-ton-bhxa/
Frezyderm Cough Syrup Kids;8,40;14,05;"&#160;Ανακαλύψτε&#160;το&#160;COUGH&#160;SYRUP&#160;KIDS&#160;Σιρόπι&#160;κατάλληλο&#160;για&#160;παιδιά&#160;που δρα ενάντια στον ξηρό βήχα&#160;και παραγωγικό βήχα.&#160;Μπείτε&#160;στη&#160;Frezyderm&#160;και δείτε περισσότερα!";Σιρόπια για τον Βήχα;5202888331015;;frezyderm/cough-syrup-kids-5202888331015.jpg;https://www.frezyderm.gr/siropia-gia-ton-bhxa/cough-syrup-kids-siropi-gia-ton-bhxa/
Frezyderm Crilen Anti-Mosquito 10%;9,52;15,90;Ανακαλύψτε το CRILEN ANTI-MOSQUITO 10% που απωθεί αποτελεσματικά τα κουνούπια και το κουνούπι τίγρης. Μπείτε στο site της FREZYDERM για περισσότερα!;Εντομοαπωθητικά;5202888224348;;frezyderm/crilen-anti-mosquito-10-5202888224348.jpg;https://www.frezyderm.gr/proionta-gia-anakoufisi-prostasia-apo-tsimpimata-entomwn/entomoapothitika/crilen-anti-mosquito-10-galaktwma-gia-prostasia-apo-kounoupia/
Frezyderm Crilen Anti-Mosquito Plus Spray 20%;8,87;14,90;Ανακαλύψτε το CRILEN ANTI-MOSQUITO PLUS SPRAY 20% που απωθεί αποτελεσματικά τα κουνούπια και το κουνούπι τίγρης. Μπείτε στο site της FREZYDERM για περισσότερα!;Εντομοαπωθητικά;5202888224355;;frezyderm/crilen-anti-mosquito-plus-spray-20-5202888224355.jpg;https://www.frezyderm.gr/proionta-gia-anakoufisi-prostasia-apo-tsimpimata-entomwn/entomoapothitika/crilen-anti-mosquito-plus-spray-20-gia-prostasia-apo-kounoupia/
Frezyderm Crilen ΓΑΛΑΚΤΩΜΑ 125ml ΜΕ ΔΩΡΟ ΕΠΙΠΛΕΟΝ ΠΟΣΟΤΗΤΑ 40ml;10,86;18,20;Για βαθιά ενυδάτωση και εντομοαπωθητική δράση υπάρχει το πακέτο με το Crilen Γαλάκτωμα σε συσκευασία δώρου με επιπλέον ποσότητα, 40ml.;Προσφορές;5202888010996;;frezyderm/crilen-125ml-40ml-5202888010996.jpg;https://www.frezyderm.gr/proionta-prosfores/crilen-entomoapwthhtiko-galaktwma/
Frezyderm Crilen Adult Plus;10,83;18,20;Ανακαλύψτε το Crilen Adult Plus ενυδατικό γαλάκτωμα και με εντομοαπώθηση. Μπείτε στο site της FREZYDERM για περισσότερα!;Εντομοαπωθητικά;5202888224300;;frezyderm/crilen-adult-plus-5202888224300.jpg;https://www.frezyderm.gr/proionta-gia-anakoufisi-prostasia-apo-tsimpimata-entomwn/enydatwsi/crilen-adult-plus-enydatiko-galaktwma-kai-me-entomoapwthish/
Frezyderm Crilen After Nip Gel;5,46;9,20;Ανακαλύψτε το εντομοαπωθητικό CRILEN AFTER NIP που καταπραΰνει τον ερεθισμό από τσιμπήματα εντόμων. Μπείτε στο site της FREZYDERM και μάθετε περισσότερα!;Εντομοαπωθητικά;5202888224263;5202888102356;frezyderm/crilen-after-nip-gel-5202888224263.png;https://www.frezyderm.gr/proionta-gia-anakoufisi-prostasia-apo-tsimpimata-entomwn/gel/crilen-after-nip-anakoufisi-tsimpimata-entomwn/
Frezyderm Crilen Cream 50ml | Pharm24.gr;6,70;11,22;Frezyderm Crilen Cream 50ml - Ενυδατικό Γαλάκτωμα με Εντομοαπωθητική Δράση σε προσφορά στο Pharm24.gr. Δωρεάν μεταφορικά σε αγορές άνω των 69€ για μέλη.;Διάφορα;5202888010989;;frezyderm/crilen-cream-50ml-pharm24-gr-5202888010989.jpg;https://www.pharm24.gr/frezyderm-crilen-cream-50ml-p-4521.html
Frezyderm Crilen Mousse;11,65;19,50;Ενυδατικός αφρός εμπλουτισμένο με κατάλληλο συνδυασμό ενεργών συστατικών που ασκούν προστασία από την εξωγενή επίδραση των εντόμων στα ακάλυπτα σημεία. Είναι σε μορφή αφρού, ώστε να εξασφαλίζει εύκολη και άριστη εφαρμογή χωρίς να αφήνει ίχνη λιπαρότητας.Δερματολογικά ελεγμένο;Εντομοαπωθητικά;5202888102219;;frezyderm/crilen-mousse-5202888102219.jpg;https://www.frezyderm.gr/proionta-gia-anakoufisi-prostasia-apo-tsimpimata-entomwn/enydatwsi/crilen-mousse-entomoapwthitiko/
Frezyderm Crilen Roll Ball;8,54;14,30;Ανακαλύψτε το Crilen Roll Ball ενυδατικό γαλάκτωμα και με εντομοαπώθηση, σε συσκευασία Roll Ball. Μπείτε στο site της FREZYDERM και μάθετε περισσότερα!;Εντομοαπωθητικά;5202888224324;;frezyderm/crilen-roll-ball-5202888224324.jpg;https://www.frezyderm.gr/proionta-gia-anakoufisi-prostasia-apo-tsimpimata-entomwn/enydatwsi/crilen-roll-ball-enydatiko-galaktwma-kai-me-entomoapwthish/
Frezyderm Crilen Anti-Mosquito Plus Spray 20%;5,10;8,54;Ανακαλύψτε το CRILEN ANTI-MOSQUITO PLUS SPRAY 20% που απωθεί αποτελεσματικά τα κουνούπια και το κουνούπι τίγρης. Μπείτε στο site της FREZYDERM για περισσότερα!;Εντομοαπωθητικά;5202888224317;5202888224256;frezyderm/crilen-anti-mosquito-plus-spray-20-5202888224317.jpg;https://www.frezyderm.gr/proionta-gia-anakoufisi-prostasia-apo-tsimpimata-entomwn/entomoapothitika/crilen-anti-mosquito-plus-spray-20-gia-prostasia-apo-kounoupia/
Frezyderm De-Make Up 4 in 1;10,12;16,90;Ανακαλύψτε το DE-MAKE UP 4 in 1 γαλάκτωμα ντεμακιγιάζ της FREZYDERM. Μπείτε τώρα στο site και δείτε όσα προϊόντα ταιριάζουν με τις δικές σας ανάγκες!;Περιποίηση Προσώπου;5202888271144;;frezyderm/de-make-up-4-in-1-5202888271144.jpg;https://www.frezyderm.gr/proionta-peripoiisis-prosopou/katharismos-proswpou/proionta-ntemakigiaz/galaktwma-ntemakigiaz/
Frezyderm - Dermiox Cream - 50ml;30,50;51,06;"Αντιγήρανση &amp; σύσφιξη Η Dermiox Cream της Frezyderm μειώνει τις ρυτίδες, στατικές ή έκφρασης, που έχουν εμφανιστεί στο πρόσωπο (μέτωπο, μεσόφρυο,...";Διάφορα;5202888271182;5202888271243;frezyderm/dermiox-cream-50ml-5202888271182.jpg;https://www.pharmacy295.gr/catalog/prosopo/kremes-prosopoy/product/frezyderm-dermiox-cream-50ml--5202888271182
Frezyderm Dermofilia Adults Deo Cream;5,76;9,70;Αποσμητικό με υβριδική καινοτομία έξυπνων ενεργών μικροσπόγγων μέσα σε μία ενυδατική κρέμα που σέβεται την ισορροπία του δερματικού μικροβιώματος κ...;Περιποίηση Σώματος;5202888224379;;frezyderm/dermofilia-adults-deo-cream-5202888224379.jpg;https://www.frezyderm.gr/peripoiisi-somatos/aposmhtika-gia-paidia-enhlikes/adults-deo-cream-hybrid-deodorant-formula/
