Όνομα;Χονδρική τιμή (€);Λιανική τιμή (€);Περιγραφή;Κατηγορία;Barcode (EAN);Παραλλαγές (variants);Φωτογραφία;URL επίσημου site
Frezyderm Hydroral Xero Mouthwash;5,30;8,87;Ανακαλύψτε το στοματικό διάλυμα κατά της ξηροστομίας hydroral xero mouthwash. Μπείτε στο site της FREZYDERM και μάθετε περισσότερα!;Στοματική Υγιεινή;5202888282065;;frezyderm/hydroral-xero-mouthwash-5202888282065.jpg;https://www.frezyderm.gr/proionta-gia-th-stomatikh-ygieinh/proionta-stomatikhs-ygieinhs-gia-enhlikes/proionta-kata-ths-kshrostomias/hydroral-xero-mouthwash-stomatiko-dialuma-kata-tis-xirostomias/
Frezyderm Hydroral Xero Toothpaste;4,90;8,20;Ανακαλύψτε την οδοντόκρεμα κατά της ξηροστομίας hydroral xero toothpaste. Μπείτε στο site της FREZYDERM και μάθετε περισσότερα!;Στοματική Υγιεινή;5202888281099;;frezyderm/hydroral-xero-toothpaste-5202888281099.jpg;https://www.frezyderm.gr/proionta-gia-th-stomatikh-ygieinh/proionta-stomatikhs-ygieinhs-gia-enhlikes/proionta-kata-ths-kshrostomias/hydroral-xero-toothpaste-odontokrema-kata-tis-xirostomias/
Frezyderm Ice Eyes Stick;23,90;40,01;Ανακαλύψτε το αντιρυτιδικό τζελ πάγου ματιών, ICE EYES STICK της FREZYDERM που προσφέρει φωτεινότητα και ξεκούραστη όψη. Μπείτε στο site και δείτε περισσότερα!;Περιποίηση Προσώπου;5202888271380;;frezyderm/ice-eyes-stick-5202888271380.png;https://www.frezyderm.gr/proionta-peripoiisis-prosopou/proionta-peripoihshs-matiwn/antirutidiko-tzel-pagou-matiwn/
Frezyderm Icy After Sun Relieving Cooling Hydrogel Face & Body 200ml | Pharm24.gr;8,70;14,60;Frezyderm Icy After Sun Relieving Cooling Hydrogel Face & Body 200ml - Υδρογέλη Αποκατάστασης Δέρματος Μετά την Έντονη Έκθεση στον Ήλιο σε προσφορά στο Pharm24.gr. Δωρεάν μεταφορικά σε αγορές άνω των 69€ για μέλη.;Διάφορα;5202888222474;;frezyderm/icy-after-sun-relieving-cooling-hydrogel-face-body-200ml-pharm24-gr-5202888222474.jpg;https://www.pharm24.gr/frezyderm-icy-after-sun-face-body-relieving-cooling-hydrogel-200ml-p-60417.html
Frezyderm Intim Vaginal Douche Monodose ΞΥΔΙ pH 3.5;4,48;8,20;Ανακαλύψτε το ενδοκολπικό καθαριστικό INTIM VAGINAL DOUCHE MONODOSE ΞΥΔΙ pH 3.5 με αντιμικροβιακή προστασία. Μπείτε στο site της FREZYDERM.;Ευαίσθητη Περιοχή;5202888223143;;frezyderm/intim-vaginal-douche-monodose-ph-3-5-5202888223143.jpg;https://www.frezyderm.gr/peripoihsh-euaisthhths-perioxhs/endokolpikos-katharismos/intim-ksudi-ph-3-5-endokolpiko-katharistiko/
Frezyderm Immuno Defence 30caps | Pharm24.gr;18,90;31,60;Frezyderm Immuno Defence 30caps - Συμπλήρωμα Διατροφής με Βιταμίνη D3, Σελήνιο & Ψευδάργυρο με Εκχύλισμα Εχινάκειας για την Ενίσχυση του Ανοσοποιητικού Συστήματος σε προσφορά στο Pharm24.gr. Δωρεάν μεταφορικά σε αγορές άνω των 69€ για μέλη.;Διάφορα;5202888331558;;frezyderm/immuno-defence-30caps-pharm24-gr-5202888331558.jpg;https://www.pharm24.gr/frezyderm-immuno-defence-30caps-p-56321.html
Frezyderm Infant Sun Care Spf 50+;14,04;23,50;Αντηλιακό γαλάκτωμα προσώπου και σώματος για νήπια, που προσφέρει αποτελεσματική πολύ υψηλή ηλιοπροστασία μόνο με φυσικά φίλτρα. Δημιουργεί ένα αδιάβροχο φιλμ προστασίας με γαλάζιο φυτικό χρώμα, που υποδεικνύει την ακριβή περιοχή εφαρμογής. Παράλληλα, η εμπλουτισμένη του σύνθεση με χαμομήλι, προστατεύει από την αφυδάτωση και τους ερεθισμούς. Απορροφάται άμεσα και δεν αφήνει λευκή ή γαλάζια χροιά.Επισκεφθείτε τη Frezyland, έναν κόσμο γεμάτο δραστήριες μαμάδες!;Φροντίδα Μωρού;5202888271212;;frezyderm/infant-sun-care-spf-50-5202888271212.jpg;https://www.frezyderm.gr/frontida-mwrou/brefika-antiliaka/infant-sun-care-spf-50-brefiko-antiliako/
Frezyderm Instant Lifting Serum 15Ml;29,70;49,72;Προϊόν Frezyderm — FREZYDERM INSTANT LIFTING SERUM 15ML;Διάφορα;5202888271205;5200888271201;frezyderm/anti-wrinkle-rich-day-cream-anti-wrinkle-night-15ml-eye-cream-5ml-amp-velvet-colors-medium-5202888271205.jpg;
Frezyderm Intim Aid Cleanser;12,61;18,00;Εξειδικευμένο καθαριστικό της ευαίσθητης περιοχής, που χρησιμοποιείται σε περιπτώσεις τοπικών ερεθισμών και διαταραχών της αιδοιοκολπικής περιοχής. Προσφέρει αποτελεσματικό, απαλό καθαρισμό και επαναφέρει το όξινο pH της ευαίσθητης περιοχής. Μειώνει τις δυσάρεστες οσμές, την αίσθηση δυσφορίας από εκκρίσεις υγρών, ενώ ενισχύει τη φυσική άμυνα της περιοχής. Μπορεί να χρησιμοποιηθεί και από τους δύο συντρόφους και συνεπικουρεί φαρμακευτικές αγωγές.;Ευαίσθητη Περιοχή;5202888223167;;frezyderm/intim-aid-cleanser-5202888223167.jpg;https://www.frezyderm.gr/peripoihsh-euaisthhths-perioxhs/katharismos/intim-aid-cleanser-katharistiko-euaisthhths-perioxhs/
Frezyderm Intim Aid Cleanser;13,60;19,50;Εξειδικευμένο καθαριστικό της ευαίσθητης περιοχής, που χρησιμοποιείται σε περιπτώσεις τοπικών ερεθισμών και διαταραχών της αιδοιοκολπικής περιοχής. Προσφέρει αποτελεσματικό, απαλό καθαρισμό και επαναφέρει το όξινο pH της ευαίσθητης περιοχής. Μειώνει τις δυσάρεστες οσμές, την αίσθηση δυσφορίας από εκκρίσεις υγρών, ενώ ενισχύει τη φυσική άμυνα της περιοχής. Μπορεί να χρησιμοποιηθεί και από τους δύο συντρόφους και συνεπικουρεί φαρμακευτικές αγωγές.;Ευαίσθητη Περιοχή;5202888223198;;frezyderm/intim-aid-cleanser-5202888223198.jpg;https://www.frezyderm.gr/peripoihsh-euaisthhths-perioxhs/katharismos/intim-aid-cleanser-katharistiko-euaisthhths-perioxhs/
Frezyderm Intim Aid Cranberry Foam;5,98;10,01;Ανακαλύψτε τον ειδικό αφρό καθαρισμού INTIM AID CRANBERRY FOAM PH 5.0 για τη φροντίδα του ουροποιητικού συστήματος. Μπείτε στο site της FREZYDERM για περισσότερα!;Ευαίσθητη Περιοχή;5202888223235;;frezyderm/intim-aid-cranberry-foam-5202888223235.jpg;https://www.frezyderm.gr/peripoihsh-euaisthhths-perioxhs/katharismos/intim-aid-cranberry-foam-afros-katharismou-gia-euaisthiti-periohi-ph5/
Frezyderm Intim Vaginal Douche Monodose ΣΟΔΑ pH 9;5,98;10,01;Ανακαλύψτε το ενδοκολπικό καθαριστικό INTIM VAGINAL DOUCHE ΣΟΔΑ pH 9 που ενισχύει τα αποτελέσματα των φαρμακευτικών αγωγών. Μπείτε στο site της FREZYDERM.;Ευαίσθητη Περιοχή;5202888223211;;frezyderm/intim-vaginal-douche-monodose-ph-9-5202888223211.jpg;https://www.frezyderm.gr/peripoihsh-euaisthhths-perioxhs/endokolpikos-katharismos/intim-soda-ph-9-endokolpiko-katharistiko/
Frezyderm Intim Area Menopause Foam;12,61;18,00;Ανακαλύψτε τον ειδικό αφρό καθαρισμού για μετά την εμμηνόπαυση INTIM AREA MENOPAUSE FOAM pH 7.0. Μπείτε στο site της FREZYDERM για περισσότερα!;Ευαίσθητη Περιοχή;5202888100093;5202888227967;frezyderm/intim-area-menopause-foam-5202888100093.jpg;https://www.frezyderm.gr/peripoihsh-euaisthhths-perioxhs/katharismos/intim-area-menopause-foam-afros-katharismou-ph-70-/
Frezyderm Intim Area Menopause Foam;13,60;19,46;Ανακαλύψτε τον ειδικό αφρό καθαρισμού για μετά την εμμηνόπαυση INTIM AREA MENOPAUSE FOAM pH 7.0. Μπείτε στο site της FREZYDERM για περισσότερα!;Ευαίσθητη Περιοχή;5202888223174;;frezyderm/intim-area-menopause-foam-5202888223174.jpg;https://www.frezyderm.gr/peripoihsh-euaisthhths-perioxhs/katharismos/intim-area-menopause-foam-afros-katharismou-ph-70-/
Frezyderm Intim Area Liquid;9,79;14,01;Ανακαλύψτε το υγρό καθαριστικό INTIM AREA LIQUID για αποτελεσματικό καθαρισμό της ευαίσθητης περιοχής κατά την αναπαραγωγική ηλικία. Μπείτε στο frezyderm.gr!;Ευαίσθητη Περιοχή;5202888227110;;frezyderm/intim-area-liquid-5202888227110.jpg;https://www.frezyderm.gr/peripoihsh-euaisthhths-perioxhs/katharismos/intim-area-liquid-katharistiko-euaisthhths-perioxhs/
Frezyderm Intim Area Liquid;10,78;15,43;Ανακαλύψτε το υγρό καθαριστικό INTIM AREA LIQUID για αποτελεσματικό καθαρισμό της ευαίσθητης περιοχής κατά την αναπαραγωγική ηλικία. Μπείτε στο frezyderm.gr!;Ευαίσθητη Περιοχή;5202888223181;;frezyderm/intim-area-liquid-5202888223181.jpg;https://www.frezyderm.gr/peripoihsh-euaisthhths-perioxhs/katharismos/intim-area-liquid-katharistiko-euaisthhths-perioxhs/
Frezyderm Intim Area Wipes;3,08;5,16;Ανακαλύψτε τα μαντήλια καθαρισμού ευαίσθητης περιοχής INTIM AREA WIPES και δοκιμάστε τα. Μπείτε στο site της FREZYDERM και δείτε περισσότερα!;Ευαίσθητη Περιοχή;5202888227141;5202888227295;frezyderm/intim-area-wipes-5202888227141.jpg;https://www.frezyderm.gr/peripoihsh-euaisthhths-perioxhs/katharismos/intim-area-wipes-manthlakia-katharismou/
Frezyderm Intim Vaginal Douche Monodose ΣΟΔΑ pH 9;3,80;6,40;Ανακαλύψτε το ενδοκολπικό καθαριστικό INTIM VAGINAL DOUCHE ΣΟΔΑ pH 9 που ενισχύει τα αποτελέσματα των φαρμακευτικών αγωγών. Μπείτε στο site της FREZYDERM.;Ευαίσθητη Περιοχή;5202888223129;;frezyderm/intim-vaginal-douche-monodose-ph-9-5202888223129.jpg;https://www.frezyderm.gr/peripoihsh-euaisthhths-perioxhs/endokolpikos-katharismos/intim-soda-ph-9-endokolpiko-katharistiko/
Frezyderm Intim Vaginal Douche Monodose ΧΑΜΟΜΗΛΙ pH 4.5;4,65;7,80;Ανακαλύψτε το ενδοκολπικό καθαριστικό INTIM DOUCHE MONODOSE ΧΑΜΟΜΗΛΙ pH 4.5 που ενισχύει τη φυσιολογική χλωρίδα. Μπείτε στο site της FREZYDERM.;Ευαίσθητη Περιοχή;5202888223136;;frezyderm/intim-vaginal-douche-monodose-ph-4-5-5202888223136.jpg;https://www.frezyderm.gr/peripoihsh-euaisthhths-perioxhs/endokolpikos-katharismos/intim-xamomhli-ph-4-5-endokolpiko-katharistiko/
Frezyderm Intim Aid Cleanser;11,30;18,92;Εξειδικευμένο καθαριστικό της ευαίσθητης περιοχής, που χρησιμοποιείται σε περιπτώσεις τοπικών ερεθισμών και διαταραχών της αιδοιοκολπικής περιοχής. Προσφέρει αποτελεσματικό, απαλό καθαρισμό και επαναφέρει το όξινο pH της ευαίσθητης περιοχής. Μειώνει τις δυσάρεστες οσμές, την αίσθηση δυσφορίας από εκκρίσεις υγρών, ενώ ενισχύει τη φυσική άμυνα της περιοχής. Μπορεί να χρησιμοποιηθεί και από τους δύο συντρόφους και συνεπικουρεί φαρμακευτικές αγωγές.;Ευαίσθητη Περιοχή;5202888102189;;frezyderm/intim-aid-cleanser-5202888102189.jpg;https://www.frezyderm.gr/peripoihsh-euaisthhths-perioxhs/katharismos/intim-aid-cleanser-katharistiko-euaisthhths-perioxhs/
Frezyderm Intimeo 325mg, 14caps - Online Pharmacy Ofarmakopoiosmou.gr;13,42;22,50;Dietary supplement containing four live cells of lactobacilli and ensures intimate area health.;Διάφορα;5202888106194;;frezyderm/intimeo-325mg-14caps-online-pharmacy-ofarmakopoiosmou-gr-5202888106194.jpg;https://www.ofarmakopoiosmou.gr/en/frezyderm-intimeo-325mg-14caps
Frezyderm Kids Sun Care Cream Spray Spf50+, 275ml | Pharm24.gr;17,07;28,60;Frezyderm Kids Sun Care Cream Spray Spf50+, 275ml - Παιδικό Αντηλιακό Πολύ Υψηλής Προστασίας Προσώπου & Σώματος σε Μορφή Κρέμας σε προσφορά στο Pharm24.gr. Δωρεάν μεταφορικά σε αγορές άνω των 69€ για μέλη.;Διάφορα;5202888222450;;frezyderm/kids-sun-care-cream-spray-spf50-275ml-pharm24-gr-5202888222450.jpg;https://www.pharm24.gr/frezyderm-kids-sun-care-cream-spray-spf50-275ml-p-46043.html
Frezyderm Sensitive Kids Deodorant Cream;4,98;8,90;Ανακαλύψτε το SENSITIVE KIDS DEODORANT CREAM, ένα αποσμητικό για παιδιά, αλλά και ενήλικες. Μπείτε στη FREZYDERM και βρείτε περισσότερα!;Περιποίηση Σώματος;5202888230165;;frezyderm/sensitive-kids-deodorant-cream-5202888230165.jpg;https://www.frezyderm.gr/peripoiisi-somatos/aposmhtika-gia-paidia-enhlikes/sensitive-kids-deodorant-cream-aposmhtiko-gia-paidia/
Frezyderm Kids Sun Care Spf 50+ Wet Skin Spray;15,51;25,96;Ανακαλύψτε το παιδικό αντηλιακό σπρέι πολύ υψηλής προστασίας που ψεκάζεται απευθείας και σε βρεγμένο δέρμα. Μπείτε στο site της FREZYDERM και δείτε περισσότερα!;Παιδική Περιποίηση;5202888222269;;frezyderm/kids-sun-care-spf-50-wet-skin-spray-5202888222269.jpg;https://www.frezyderm.gr/proionta-paidikhs-peripoihshs/paidika-anthliaka/kids-sun-care-spf-50-paidiko-anthliako-sprei/
Frezyderm Kids Sun Care Spf 50+ Wet Skin Spray;15,51;25,96;Ανακαλύψτε το παιδικό αντηλιακό σπρέι πολύ υψηλής προστασίας που ψεκάζεται απευθείας και σε βρεγμένο δέρμα. Μπείτε στο site της FREZYDERM και δείτε περισσότερα!;Παιδική Περιποίηση;5202888222429;;frezyderm/kids-sun-care-spf-50-wet-skin-spray-5202888222429.jpg;https://www.frezyderm.gr/proionta-paidikhs-peripoihshs/paidika-anthliaka/kids-sun-care-spf-50-paidiko-anthliako-sprei/
Frezyderm Kids Sun Care Spf 50+ Wet Skin Spray;15,51;25,96;Ανακαλύψτε το παιδικό αντηλιακό σπρέι πολύ υψηλής προστασίας που ψεκάζεται απευθείας και σε βρεγμένο δέρμα. Μπείτε στο site της FREZYDERM και δείτε περισσότερα!;Παιδική Περιποίηση;1111111021194;5202888102554;frezyderm/kids-sun-care-spf-50-wet-skin-spray-1111111021194.jpg;https://www.frezyderm.gr/proionta-paidikhs-peripoihshs/paidika-anthliaka/kids-sun-care-spf-50-paidiko-anthliako-sprei/
Frezyderm for Kids Sun+Nip Lotion Spf50+, 175ml | Pharm24.gr;17,07;28,60;Frezyderm for Kids Sun+Nip Lotion Spf50+, 175ml - Παιδικό Αντηλιακό Γαλάκτωμα για Πρόσωπο & Σώμα με Εντομοαπωθητικούς Παράγοντες σε προσφορά στο Pharm24.gr. Δωρεάν μεταφορικά σε αγορές άνω των 69€ για μέλη.;Διάφορα;5202888222436;;frezyderm/for-kids-sun-nip-lotion-spf50-175ml-pharm24-gr-5202888222436.jpg;https://www.pharm24.gr/frezyderm-kids-sunnip-spf50-175ml-p-28595.html
Frezyderm Lice Free Set;9,56;16,01;Ανακαλύψτε τα παιδικά προϊόντα για ψείρες της σειράς LICE FREE SET και αντιμετωπίστε τις αποτελεσματικά. Μπείτε στο site της FREZYDERM και μάθετε περισσότερα!;Παιδική Περιποίηση;5202888221996;;frezyderm/lice-free-set-5202888221996.jpg;https://www.frezyderm.gr/proionta-paidikhs-peripoihshs/antiftheirika-gia-paidia/proionta-gia-pseires-lice-free-set/
Frezyderm Lice Rep Extreme Spray;9,11;15,30;Προληπτική αντιφθειρική λοσιόν για καθημερινή χρήση. Χαρίζει απαλότητα και λάμψη. Δεν λαδώνει τα μαλλιά. Χρησιμοποιείτε τo Lice Rep Extreme Spray με ασφαλή τρόπο. Να διαβάζετε πάντα την ετικέτα και τις πληροφορίες για το προϊόν πριν τη χρήση.;Παιδική Περιποίηση;5202888224270;5202888224249;frezyderm/lice-rep-extreme-spray-5202888224270.jpg;https://www.frezyderm.gr/proionta-paidikhs-peripoihshs/antiftheirika-gia-paidia/lice-rep-lotion-gia-pseires/
Frezyderm Lice Rep Extreme Spray;10,65;17,80;Προληπτική αντιφθειρική λοσιόν για καθημερινή χρήση. Χαρίζει απαλότητα και λάμψη. Δεν λαδώνει τα μαλλιά. Χρησιμοποιείτε τo Lice Rep Extreme Spray με ασφαλή τρόπο. Να διαβάζετε πάντα την ετικέτα και τις πληροφορίες για το προϊόν πριν τη χρήση.;Παιδική Περιποίηση;5202888224904;;frezyderm/lice-rep-extreme-spray-5202888224904.jpg;https://www.frezyderm.gr/proionta-paidikhs-peripoihshs/antiftheirika-gia-paidia/lice-rep-lotion-gia-pseires/
Frezyderm Lipolysis Cream Booster 5ml;8,66;14,50;Προϊόν Frezyderm — FREZYDERM Lipolysis Cream Booster 5ml;Διάφορα;5202888273100;;;
Frezyderm Macrogol Adults 3350;8,29;13,88;Ανακαλύψτε τη σκόνη για πόσιμο διάλυμα Macrogol ADULTS 3350, για την αντιμετώπιση της δυσκοιλιότητας. Μπείτε στο site της FREZYDERM για περισσότερα!;Θεραπεία Δυσκοιλιότητας;5202888111006;;frezyderm/macrogol-adults-3350-5202888111006.jpg;https://www.frezyderm.gr/sumptwmatikh-therapeia-duskoiliotitas/macrogol-adults-3350-skoni-gia-duskoiliotita/
Frezyderm Macrogol Kids 3350;7,65;12,81;Ανακαλύψτε τη σκόνη για πόσιμο διάλυμα Macrogol KIDS 3350, για την αντιμετώπιση της δυσκοιλιότητας σε παιδιά. Μπείτε στο site της FREZYDERM για περισσότερα!;Θεραπεία Δυσκοιλιότητας;5202888111013;;frezyderm/macrogol-kids-3350-5202888111013.jpg;https://www.frezyderm.gr/sumptwmatikh-therapeia-duskoiliotitas/macrogol-kids-3350-skoni-gia-duskoiliotita-se-paidia/
Frezyderm Matte Effect Cream 50ml;14,60;24,44;Προϊόν Frezyderm — FREZYDERM Matte Effect Cream 50ml;Διάφορα;5202888271229;;frezyderm/moisturizing-rich-micellar-water-50ml-5202888271229.png;
Frezyderm Mediated Cream-Gel 50ml;10,82;18,11;Προϊόν Frezyderm — FREZYDERM Mediated Cream-Gel 50ml;Διάφορα;5202888105074;;frezyderm/moisturizing-rich-micellar-water-50ml-5202888105074.png;
Frezyderm Mediated Sh.Dry Dandr.200Ml;11,10;18,58;Προϊόν Frezyderm — FREZYDERM MEDIATED SH.DRY DANDR.200ML;Διάφορα;5202888105067;;;
Frezyderm Ac-Norm Micellar Water;7,15;11,97;"Υδατικό διάλυμα με αντιερεθιστικά συστατικά που αποκαθιστά τη δερματική ευεξία στο ταλαιπωρημένο δέρμα. Αφαιρεί αποτελεσματικά το σμήγμα και τα υπολείμματα των φαρμακευτικών προϊόντων, προσφέρει ενισχυμένη κερατολυτική δράση, μειώνει τη δερματική δυσανεξία και την αίσθηση &#171;τραβήγματος&#187;.Δερματολογικά Ελεγμένο";Περιποίηση Προσώπου;5202888271304;;frezyderm/ac-norm-micellar-water-5202888271304.jpg;https://www.frezyderm.gr/proionta-peripoiisis-prosopou/proionta-katharismou-liparou-dermatos-me-tash-akmhs/ac-norm-micellar-water-calming-lotion/
Frezyderm Mild Foam Wash 150ml | Pharm24.gr;11,56;16,54;Frezyderm Mild Foam Wash 150ml - Απαλό Αφρώδες Καθαριστικό για Ευαίσθητες Επιδερμίδες σε προσφορά στο Pharm24.gr. Δωρεάν μεταφορικά σε αγορές άνω των 69€ για μέλη.;Διάφορα;5202888100123;;frezyderm/mild-foam-wash-150ml-pharm24-gr-5202888100123.jpg;https://www.pharm24.gr/frezyderm-mild-foam-wash-150ml-p-3633.html
Frezyderm Mild Wash Liquid;8,99;12,90;Ανακαλύψτε το απαλό καθαριστικό προσώπου MILD WASH LIQUID της FREZYDERM. Μπείτε τώρα στο site και δείτε όσα προϊόντα ταιριάζουν με τις δικές σας ανάγκες!;Περιποίηση Προσώπου;5202888223150;;frezyderm/mild-wash-liquid-5202888223150.jpg;https://www.frezyderm.gr/proionta-peripoiisis-prosopou/katharismos-proswpou/katharistika-prosopou/apalo-katharistiko-prosopou/
Frezyderm Moisturizing 24h Cream 20+ 50ml | Pharm24.gr;14,94;25,00;Frezyderm Moisturizing 24h Cream 20+ 50ml - Ενυδατική Κρέμα 24h για Ηλικίες 20+ σε προσφορά στο Pharm24.gr. Δωρεάν μεταφορικά σε αγορές άνω των 69€ για μέλη.;Διάφορα;5202888271007;;frezyderm/moisturizing-24h-cream-20-50ml-pharm24-gr-5202888271007.jpg;https://www.pharm24.gr/frezyderm-moisturizing-24h-cream-20-50ml-p-86.html
Frezyderm Moisturizing Plus Cream 30+, 50ml | Pharm24.gr;17,72;29,70;Frezyderm Moisturizing Plus Cream 30+, 50ml - Εντατική Ενυδάτωση & Επανόρθωση Προσώπου & Λαιμού για Ηλικίες 30+ σε προσφορά στο Pharm24.gr. Δωρεάν μεταφορικά σε αγορές άνω των 69€ για μέλη.;Διάφορα;5202888271014;;frezyderm/moisturizing-plus-cream-30-50ml-pharm24-gr-5202888271014.jpg;https://www.pharm24.gr/frezyderm-moisturizing-plus-cream-30-50ml-p-87.html
Frezyderm Moisturizing Rich Cream Age 45+, 50ml | Pharm24.gr;18,34;27,62;Frezyderm Moisturizing Rich Cream Age 45+, 50ml - Ενυδατική Κρέμα για Ξηρό Δέρμα, για Ώριμες Επιδερμίδες, Ηλικίες 45+ σε προσφορά στο Pharm24.gr. Δωρεάν μεταφορικά σε αγορές άνω των 69€ για μέλη.;Διάφορα;5202888271021;;frezyderm/moisturizing-rich-cream-age-45-50ml-pharm24-gr-5202888271021.jpg;https://www.pharm24.gr/frezyderm-moisturizing-rich-cream-age-45-50ml-p-88.html
Frezyderm Gingivital Mouthwash 250ml | Pharm24.gr;6,08;10,20;Frezyderm Gingivital Mouthwash 250ml - Φθοριούχο Στοματικό Διάλυμα Κατά της Ουλίτιδας σε προσφορά στο Pharm24.gr. Δωρεάν μεταφορικά σε αγορές άνω των 69€ για μέλη.;Διάφορα;5202888282027;;frezyderm/gingivital-mouthwash-250ml-pharm24-gr-5202888282027.jpg;https://www.pharm24.gr/frezyderm-gingivital-mouthwash-250ml-p-11386.html
Frezyderm Homeopathy Mouthwash;6,08;10,20;"Στοματικό διάλυμα για μια ολοκληρωμένη στοματική φροντίδα των ατόμων που ακολουθούν ομοιοπαθητική αγωγή. Με σύνθεση απαλλαγμένη από ουσίες που αντιδοτούν στην ομοιοπαθητική αγωγή.&amp;nbsp;- Καταπολεμά τη μικροβιακή πλάκα- Προφυλάσσει από την τερηδόνα- Προστατεύει τα ούλα- Προσφέρει ευχάριστη δροσερή αναπνοήΜάθετε περισσότερα για την στοματική υγιεινή στο νέο μας blog!";Στοματική Υγιεινή;5202888283017;;frezyderm/homeopathy-mouthwash-5202888283017.jpg;https://www.frezyderm.gr/proionta-gia-th-stomatikh-ygieinh/proionta-stomatikhs-ygieinhs-gia-enhlikes/proionta-stomatikhs-ygieinhs-kai-omoiopathhtikh/homeopathy-mouthwash-stomatiko-dialuma-sumbato-me-omoiopathitiki-agwgi/
