Όνομα;Χονδρική τιμή (€);Περιγραφή;Κατηγορία;Barcode (EAN);Φωτογραφία;URL επίσημου site
AΒΙLAR 10% ΑΛΟΙΦΗ ΡΗΤΙΝΗΣ;;Επουλωτική, Αντιφλεγμονώδης και Αντιμικροβιακή φυσική αλοιφή με ρητίνη νορβηγικής ελάτης 10%. Ένα πιστοποιημένο ιατροτεχνολογικό προιόν κλάσης IIβ το οποίο ενδείκνυται για τοπική θεραπεία μολυσμένων και μη μολυσμένων πληγών στο σπίτι ή απο επαγγελματίες υγείας και παρασκευάζεται από τη Help Pharmaceuticals. Ιδανική για τραύματα, εγκαύματα, έλκη κατάκλισης ή διαβητικά έλκη και χειρουργικές πληγές.;Ειδική Φροντίδα;5205649000007;https://www.vican.gr/pub/media/catalog/product/cache/943338449f392e591c2115a51e5b080b/5/2/5205649000007_1_t20230717095735.jpg;https://www.vican.gr/el/abilar-10-aloifi-ritinis-5205649000007.html
CARNATION TOE PROTECTOR;;Το Carnation Τoe Protector είναι ένα πλήρως επενδυμένο και ενισχυμένο προστατευτικό δακτύλων με polymer gel. Ανακουφίζει από τον πόνο, απορροφά τους κραδασμούς και μειώνει την τριβή σε όλη την περιοχή των δακτύλων συμπεριλαμβανομένης και της άκρης αυτών. Το ειδικό σχήμα του ταιριάζει με άνεση σε κάθε παπούτσι, ενώ η ελαστικότητά του το συγκρατεί στη θέση του και το προσαρμόζει σε κάθε μέγεθος δακτύλου.;Περιποίηση Ποδιών;5012654202803;https://www.vican.gr/pub/media/catalog/product/cache/943338449f392e591c2115a51e5b080b/5/0/5012654202803_t20230418163921.jpg;https://www.vican.gr/el/carnation-toe-protector-5012654202803.html
CARNATION HARD SKIN REMOVER PEN;;Το Hard Skin Remover Pen είναι ένα ειδικά σχεδιασμένο στυλό, το οποίο μαλακώνει τις σκληρές περιοχές του ποδιού. Χάρη στο διαμορφωμένο σχήμα της κεφαλής του, επιτρέπει την ακριβή εφαρμογή στην περιοχή που χρειάζεται φροντίδα. Η χρήση του μπορεί να διαρκέσει για περισσότερες από 100 εφαρμογές.;Περιποίηση Ποδιών;5012654202698;https://www.vican.gr/pub/media/catalog/product/cache/943338449f392e591c2115a51e5b080b/5/0/5012654202698_t20230418163921.jpg;https://www.vican.gr/el/carnation-hard-skin-remover-pen-5012654202698.html
CARNATION WARM FLEECE INSOLES;;Τα Carnation Warm Fleece Insoles είναι χειμωνιάτικοι πάτοι υποδημάτων με λεπτή fleece επίστρωση για να διατηρούν τα πόδια ζεστά. Είναι ιδανικοί για χειμερινά σπορ και για;Περιποίηση Ποδιών;5012654202384;https://www.vican.gr/pub/media/catalog/product/cache/943338449f392e591c2115a51e5b080b/5/0/5012654202384_t20230418163921.jpg;https://www.vican.gr/el/carnation-warm-fleece-insoles-5012654202384.html
CARNATION FOOT SCRUB;;Η κρέμα απολέπισης ποδιών Carnation Foot Scrub είναι ειδικά σχεδιασμένη, ώστε να αφήνει τα πόδια σας απαλά και αναζωογονημένα. Αφαιρεί τα νεκρά κύτταρα και το σκληρό δέρμα, ενώ παράλληλα ενυδατώνει την πάσχουσα περιοχή, κάνοντας τα πόδια πιο ανάλαφρα.;Περιποίηση Ποδιών;5012654202360;https://www.vican.gr/pub/media/catalog/product/cache/943338449f392e591c2115a51e5b080b/5/0/5012654202360_t20230418163921.jpg;https://www.vican.gr/el/carnation-foot-scrub-5012654202360.html
CARNATION CRACKED HEEL CREAM;;Η κρέμα Cracked Heel Cream της Carnation Footcare αναζωογονεί τις σκασμένες, ξηρές και ταλαιπωρημένες φτέρνες, χαρίζοντας βαθιά ενυδάτωση και ελαστικότητα στο δέρμα των ποδιών. Τα πολύτιμα συστατικά της ανακουφίζουν και θρέφουν τα ξηρά πόδια, ενώ επανορθώνουν τα σκασίματα και τις ρωγμές. Η ειδική της σύνθεση με 20% urea συμβάλλει στην πλήρη επανόρθωση της επιδερμίδας χαρίζοντας υγιή όψη. Με εκχύλισμα μέντας που χαρίζει μία αίσθηση δροσιάς και φρεσκάδας.;Περιποίηση Ποδιών;5012654202353;https://www.vican.gr/pub/media/catalog/product/cache/943338449f392e591c2115a51e5b080b/5/0/5012654202353_1_t20240330112000.jpg;https://www.vican.gr/el/carnation-cracked-heel-cream-5012654202353.html
CARNATION HEALTHY NAILS;;Το Carnation Healthy Nails χάρη στην αντιμικροβιακή του σύνθεση, είναι ειδικά σχεδιασμένο για τον άμεσο καθαρισμό των νυχιών, των δακτύλων των ποδιών, αλλά και των παρανυχίδων από τους παθογόνους μικροοργανισμούς. Αντιμετωπίζει τους μικρό-οργανισμούς π.χ. μύκητες που μπορούν να προκαλέσουν παραμόρφωση των νυχιών. Η συστηματική χρήση του απαλλάσσει από τους μικροοργανισμούς, εμποδίζει την εξάπλωσή τους και προστατεύει το νύχι από την επανεμφάνισή τους.;Περιποίηση Ποδιών;5012654202377;https://www.vican.gr/pub/media/catalog/product/cache/943338449f392e591c2115a51e5b080b/5/0/5012654202377_t20230418163921.jpg;https://www.vican.gr/el/carnation-healthy-nails-5012654202377.html
CARNATION SOOTHING FOOT POWDER;;H πούδρα ποδιών Carnation Soothing Foot Powder καταπραΰνει και φρεσκάρει τα πόδια, βοηθώντας στη διατήρηση μιας υγιούς επιδερμίδας. Βοηθά στην απορρόφηση της υπερβολικής υγρασίας, χαρίζοντας μια αίσθηση φρεσκάδας και άνεσης στην περιοχή των ποδιών.;Περιποίηση Ποδιών;5012654202322;https://www.vican.gr/pub/media/catalog/product/cache/943338449f392e591c2115a51e5b080b/5/0/5012654202322_t20230418163921.jpg;https://www.vican.gr/el/carnation-soothing-foot-powder-5012654202322.html
CARNATION MOISTURISING FOOT CREAM;;H Carnation Intensive Moisturizing Cream έχει ειδικά μελετημένη φόρμουλα από Urea, η οποία θρέφει και ενυδατώνει την ξηρή επιδερμίδα του ποδιού. Μετά τη χρήση, το πόδι μένει απαλό, ενυδατωμένο και απαλό, ενώ η μέντα που περιέχει αφήνει μια αίσθηση φρεσκάδας στο πόδι. Δεν είναι λιπαρή και απορροφάται εύκολα.;Περιποίηση Ποδιών;5012654201820;https://www.vican.gr/pub/media/catalog/product/cache/943338449f392e591c2115a51e5b080b/5/0/5012654201820_t20230418163921.jpg;https://www.vican.gr/el/carnation-moisturising-foot-cream-5012654201820.html
CARNATION SILVERSOCK;;Οι κάλτσες Carnation Silversock είναι ισοθερμικές κάλτσες υψηλής ποιότητας, ειδικά μελετημένες για καθημερινή χρήση με καθαρό ασήμι. Κρατούν τα πόδια ζεστά τον χειμώνα & δροσερά το καλοκαίρι. Οι ίνες των νημάτων που συμμετέχουν στην πλέξη είναι καλυμμένες εξ ολοκλήρου με ασήμι. Ιδανικές για πάσχοντες από σακχαρώδη διαβήτη και κυκλοφορικά προβλήματα. Διατίθενται σε 2 μεγέθη.;Περιποίηση Ποδιών;5012654201110;https://www.vican.gr/pub/media/catalog/product/cache/943338449f392e591c2115a51e5b080b/5/0/5012654201110_t20230418163921.jpg;https://www.vican.gr/el/carnation-silversock-5012654201110.html
CARNATION PEDIROLLER;;Το Pediroller της Carnation προσφέρει άμεση ανακούφιση από τους συνηθισμένους πόνους στο πέλμα και τη φτέρνα. Η υπερβολική χρήση της πελματικής λωρίδας, μπορεί να δημιουργήσει φλεγμονή και έντονο πόνο. Το Pediroller της Carnation μπορεί να χρησιμοποιηθεί και ως κρυοθεραπεία αν μπει στην ψύξη πριν από την χρήση, που θα συμβάλλει στη μείωση της φλεγμονής και του πόνου.;Περιποίηση Ποδιών;5012654201530;https://www.vican.gr/pub/media/catalog/product/cache/943338449f392e591c2115a51e5b080b/5/0/5012654201530_t20230418163921.jpg;https://www.vican.gr/el/carnation-pediroller-5012654201530.html
CARNATION FRESH SHOE SPRAY;;Το Carnation Fresh Shoe Spray είναι ειδικά μελετημένο για να προσφέρει προηγμένη προστασία ενάντια στην κακοσμία των παπουτσιών. Εύκολο και πρακτικό στη χρήση, με αποσμητική δράση που διαρκεί, κρατάει τα παπούτσια καθαρά χωρίς δυσάρεστες οσμές. Έχει μη λιπαρή υφή, στεγνώνει αμέσως και κρατά το παπούτσι καθαρό και απαλλαγμένο από τα βακτήρια που δημιουργούνται από το μη αεριζόμενο περιβάλλον.;Περιποίηση Ποδιών;5012654201288;https://www.vican.gr/pub/media/catalog/product/cache/943338449f392e591c2115a51e5b080b/5/0/5012654201288_t20230418163921.jpg;https://www.vican.gr/el/carnation-fresh-shoe-spray-5012654201288.html
CARNATION COOL FOOT SPRAY;;Το Carnation Cool Foot Spray είναι η καθημερινή αντιμετώπιση του προβλήματος της υπερβολικής εφίδρωσης και της κακοσμίας των ποδιών. Το δέρμα αποκτά μια αίσθηση φρεσκάδας και καθαριότητας που διαρκεί.;Περιποίηση Ποδιών;5012654201264;https://www.vican.gr/pub/media/catalog/product/cache/943338449f392e591c2115a51e5b080b/5/0/5012654201264_t20230418163921.jpg;https://www.vican.gr/el/carnation-cool-foot-spray-5012654201264.html
CARNATION CORN & CALLOUS FILE;;H Carnation Corn & Callous File είναι λίμα που απομακρύνει τις σκληρύνσεις του δέρματος. Είναι κατασκευασμένη από ειδικό ανοξείδωτο ατσάλι υψηλής ποιότητας, το οποίο απομακρύνει αποτελεσματικά τους χόνδρους και τις σκληρύνσεις χωρίς να τραυματίζει την επιδερμίδα.;Περιποίηση Ποδιών;5012654200830;https://www.vican.gr/pub/media/catalog/product/cache/943338449f392e591c2115a51e5b080b/5/0/5012654200830_t20230418163921.jpg;https://www.vican.gr/el/carnation-corn-callous-file-5012654200830.html
CARNATION ADVANCED PRESSURE RELIEF HEEL PADS;;Οι Carnation Advanced Pressure Relief Heel Pads είναι αυτοκόλλητοι πάτοι απορρόφησης κραδασμών για το σημείο της φτέρνας. Απορροφούν τους κραδασμούς που δημιουργούνται κατά τη βάδιση και διανέμουν ισομερώς την ενέργεια σε όλη την επιφάνεια του πέλματος μειώνοντας την αίσθηση της κόπωσης σε δάκτυλα, πόδια και πλάτη. Επανέρχονται αμέσως στο φυσικό μέγεθος μετά τη χρήση και είναι ιδιαίτερα ανθεκτικοί. Απομακρύνουν την υπερβολική υγρασία από το πόδι για μεγαλύτερη αίσθηση άνεσης.;Περιποίηση Ποδιών;5012654165023;https://www.vican.gr/pub/media/catalog/product/cache/943338449f392e591c2115a51e5b080b/5/0/5012654165023_t20230418163921.jpg;https://www.vican.gr/el/carnation-advanced-pressure-relief-heel-pads-5012654165023.html
CARNATION ADVANCED PRESSURE RELIEF INSOLES;;Οι πάτοι Carnation Pressure Relief Insoles απορροφούν τους κραδασμούς που δημιουργούνται κατά τη βάδιση και διανέμουν ισομερώς την ενέργεια σε όλη την επιφάνεια του πέλματος μειώνοντας την αίσθηση της κόπωσης. Περιέχουν αντιμικροβιακούς παράγοντες, προκειμένου να εμποδίζεται η ανάπτυξη μικροβίων. Επανέρχονται αμέσως στο φυσικό μέγεθος μετά τη χρήση.;Περιποίηση Ποδιών;5012654165016;https://www.vican.gr/pub/media/catalog/product/cache/943338449f392e591c2115a51e5b080b/5/0/5012654165016_t20230418163921.jpg;https://www.vican.gr/el/carnation-advanced-pressure-relief-insoles-5012654165016.html
CARNATION SUPER DEO INSOLES;;Οι ειδικοί αντιμικροβιακοί πάτοι Carnation Super Deo Insoles καταπολεμούν την κακοσμία των ποδιών, χάρη στους ειδικούς αντιμυκητιακούς παράγοντες που αποτρέπουν την ανάπτυξη μικροβίων και μυκήτων στα πόδια.;Περιποίηση Ποδιών;5012654200861;https://www.vican.gr/pub/media/catalog/product/cache/943338449f392e591c2115a51e5b080b/5/0/5012654200861_t20230418163921.jpg;https://www.vican.gr/el/carnation-super-deo-insoles-5012654200861.html
PRONATION ΟΡΘΩΤΙΚΟΙ ΠΑΤΟΙ;;Οι ορθωτικοί πάτοι Pro-nation έχουν σχεδιαστεί ειδικά για να κατανέμουν το βάρος ισομερώς σε όλη την επιφάνεια του πέλματος και ευθυγραμμίζουν το πέλμα σωστά στο έδαφος δίνοντας στα πόδια σας στήριξη και σταθερότητα. Συγχρόνως, ανακουφίζουν τους πόνους από τον αστράγαλο, τη μέση, το γόνατο, την πλάτη, τη φτέρνα και την καμάρα. Διατίθενται σε μεγέθη: small, medium, large.;Περιποίηση Ποδιών;5012654202926;https://www.vican.gr/pub/media/catalog/product/cache/943338449f392e591c2115a51e5b080b/5/0/5012654202926_t20230418163921.jpg;https://www.vican.gr/el/pronation-orthotikoi-patoi-5012654202926.html
CARNATION FOOT MOUSSE;;Το Carnation Foot Mousse είναι ένας ειδικά σχεδιασμένος αφρός εμπλουτισμένος με 12.5% urea, που βοηθά στη διατήρηση των φυσικών φραγμών, προσφέρει άμεση ενυδάτωση και αποκατάσταση της φυσικής υγρασίας του δέρματος.;Περιποίηση Ποδιών;5012654203831;https://www.vican.gr/pub/media/catalog/product/cache/943338449f392e591c2115a51e5b080b/5/0/5012654203831_t20230418163921.jpg;https://www.vican.gr/el/carnation-foot-mousse-5012654203831.html
CARNATION SHOE DEODORISER POUCHES;;Οι αποσμητικοί σάκοι Carnation Shoe Deodoriser από φυσικό μπαμπού ξυλάνθρακα Moso, αποτελεί την ιδανική λύση για την καταπολέμηση της κακοσμίας των υποδημάτων αφήνοντας μια αίσθηση καθαριότητας και φρεσκάδας. Οι φυσικές ιδιότητες του σάκου απορροφούν την υγρασία από τα υποδήματα, παρατείνοντας έτσι τη διάρκεια ζωής τους. Εφαρμόζουν εύκολα σε κάθε παπούτσι.;Περιποίηση Ποδιών;5012654203329;https://www.vican.gr/pub/media/catalog/product/cache/943338449f392e591c2115a51e5b080b/5/0/5012654203329_t20230418163921.jpg;https://www.vican.gr/el/carnation-shoe-deodoriser-pouches-5012654203329.html
CARNATION TOENAIL SOFTENING LOTION;;Το Carnation Toe Nail Softing Lotion είναι ένα ξεχωριστό προϊόν με εξειδικευμένη δράση. Πρόκειται για ένα προϊόν που στοχεύει στην ανακούφιση από τα σκληρά και αιχμηρά σημεία στα νύχια των ποδιών.;Περιποίηση Ποδιών;5012654201424;https://www.vican.gr/pub/media/catalog/product/cache/943338449f392e591c2115a51e5b080b/5/0/5012654201424_t20230418163921.jpg;https://www.vican.gr/el/carnation-toenail-softening-lotion-5012654201424.html
CARNATION TOE SEPARATORS;;Tα Carnation Toe Separator είναι διαχωριστικά δαχτύλων, κατασκευασμένα από ειδικό polymer gel υλικό, το οποίο περιέχει μεταλλικά και ενυδατικά στοιχεία έτσι ώστε να μην δημιουργούνται σκασίματα και ερεθισμοί στα σημεία που εφαρμόζεται. Το ειδικό ευλύγιστο υλικό εφαρμόζεται ανάμεσα στα δάκτυλα, ενώ ταυτόχρονα απελευθερώνονται ενυδατικά και μεταλλικά στοιχεία που περιποιούνται την επιδερμίδα.;Περιποίηση Ποδιών;5012654200632;https://www.vican.gr/pub/media/catalog/product/cache/943338449f392e591c2115a51e5b080b/5/0/5012654200632_t20230418163921.jpg;https://www.vican.gr/el/carnation-toe-separators-5012654200632.html
CARNATION TOE SPREADER;;Το Carnation Τoe Spreader είναι διαχωριστικό δαχτύλων κατασκευασμένο από ειδικό polymer gel υλικό, το οποίο περιέχει μεταλλικά και ενυδατικά στοιχεία έτσι ώστε να μην δημιουργούνται σκασίματα και ερεθισμοί στα σημεία που εφαρμόζεται. Το ειδικό ευλύγιστο υλικό εφαρμόζεται ανάμεσα στα δάχτυλα, ενώ ταυτόχρονα απελευθερώνονται ενυδατικά στοιχεία που περιποιούνται την επιδερμίδα. Πλένεται και ξαναχρησιμοποιείται.;Περιποίηση Ποδιών;5012654200625;https://www.vican.gr/pub/media/catalog/product/cache/943338449f392e591c2115a51e5b080b/5/0/5012654200625_t20230418163921.jpg;https://www.vican.gr/el/carnation-toe-spreader-5012654200625.html
CARNATION BUNION PROTECTOR;;Το Carnation Bunion Protector είναι κατασκευασμένο από ειδικό polymer gel υλικό το οποίο περιέχει ενυδατικά και μεταλλικά στοιχεία για την καλύτερη αποτροπή άσκησης πίεσης επάνω στο κότσι. Είναι απαλή και ευλύγιστη κατασκευή, έτσι ώστε να εφαρμόζει σωστά επάνω στο κότσι, ενώ τα στοιχεία που περιέχει βοηθούν στο να ενυδατώνουν και να απαλύνουν την επιδερμίδα. Είναι ιδιαίτερα λεπτό και διακριτικό έτσι ώστε να εφαρμόζει ακόμα και στα πιο στενά παπούτσια.;Περιποίηση Ποδιών;5012654200618;https://www.vican.gr/pub/media/catalog/product/cache/943338449f392e591c2115a51e5b080b/5/0/5012654200618_t20230418163921.jpg;https://www.vican.gr/el/carnation-bunion-protector-5012654200618.html
CARNATION TIP TOES GEL HEEL SHIELDS;;Τα Tip Toes Heel Shields από ειδικό απαλό και διάφανο gel, είναι σχεδιασμένα να μειώνουν την τριβή και την ολίσθηση μέσα στο παπούτσι. Εφαρμόζουν εύκολα, είναι διακριτικά και ταιριάζουν σε γόβες και κάθε στυλ κλειστού παπουτσιού. Μπορούν επίσης να εφαρμοστούν σε mules, ώστε να αποτρέψουν την τριβή στο επάνω μέρος του ποδιού.;Περιποίηση Ποδιών;5012654201363;https://www.vican.gr/pub/media/catalog/product/cache/943338449f392e591c2115a51e5b080b/5/0/5012654201363_t20230418163921.jpg;https://www.vican.gr/el/carnation-tip-toes-gel-heel-shields-5012654201363.html
CARNATION TIP TOES GEL STRAP STRIPS;;Τα Strap Strips από ειδικό απαλό και διάφανο gel, είναι σχεδιασμένα να μειώνουν την τριβή και την πίεση που ασκούνται στο πόδι από τα λουράκια των παπουτσιών. Χάρη στην επαναστατική κατασκευή τους μπορούν να παραμένουν αόρατα ακόμα και στα πιο εμφανή σημεία, όπως για παράδειγμα στα αγαπημένα σας πέδιλα ή γόβες.;Περιποίηση Ποδιών;5012654201370;https://www.vican.gr/pub/media/catalog/product/cache/943338449f392e591c2115a51e5b080b/5/0/5012654201370_t20230418163921.jpg;https://www.vican.gr/el/carnation-tip-toes-gel-strap-strips-5012654201370.html
CARNATION TIP TOES GEL SPOTS;;Τα Tip Toes Gel Spots από ειδικό απαλό και διάφανο gel έχουν τη δυνατότητα εφαρμογής στο ακριβές σημείο του πόνου, προσφέροντας πλήρη άνεση και ξεκούραστο περπάτημα γεμάτο αυτοπεποίθηση. Εφαρμόζουν εύκολα σε κάθε στυλ παπουτσιού.;Περιποίηση Ποδιών;5012654201356;https://www.vican.gr/pub/media/catalog/product/cache/943338449f392e591c2115a51e5b080b/5/0/5012654201356_t20230418163921.jpg;https://www.vican.gr/el/carnation-tip-toes-gel-spots-5012654201356.html
CARNATION TIP TOES GEL CUSHIONS;;Οι διάφανοι και απαλοί πάτοι Tip Toes Gel Cushions είναι ειδικά σχεδιασμένοι για να συγκρατούν το πόδι μέσα στο παπούτσι αποτρέποντας την ολίσθηση και την αίσθηση πόνου στο μετατάρσιο των ποδιών. Είναι ιδανικοί για ψηλά τακούνια (λόγω της απότομης διαφοράς ύψους μεταξύ φτέρνας και δαχτύλων), μπότες και πέδιλα, ενώ εφαρμόζουν εύκολα και ταιριάζουν σε κάθε στυλ παπουτσιού.;Περιποίηση Ποδιών;5012654201240;https://www.vican.gr/pub/media/catalog/product/cache/943338449f392e591c2115a51e5b080b/5/0/5012654201240_t20230418163921.jpg;https://www.vican.gr/el/carnation-tip-toes-gel-cushions-5012654201240.html
CARNATION HEEL GRIPS;;Τα Heel Grips είναι προστατευτικά αυτοκόλλητα που εφαρμόζονται στο πίσω μέρος του παπουτσιού, μειώνοντας την τριβή με το δέρμα. Αποτρέπουν την εμφάνιση ερεθισμών και φουσκαλών, ενώ ταυτόχρονα εμποδίζουν το γλίστρημα του ποδιού μέσα στο παπούτσι. Είναι λεπτά, διακριτικά και εφαρμόζουν εύκολα.;Περιποίηση Ποδιών;5012654200878;https://www.vican.gr/pub/media/catalog/product/cache/943338449f392e591c2115a51e5b080b/5/0/5012654200878_t20230418163921.jpg;https://www.vican.gr/el/carnation-heel-grips-5012654200878.html
CARNATION FLEECY PADDING;;Το Carnation Fleecy Padding είναι αυτοκόλλητο προστατευτικό δακτύλων για το πόδι από μαλακό fleecy υλικό. Προστατεύει το πόδι από την άσκηση πίεσης και τριβής με το παπούτσι, ενώ εφαρμόζει τέλεια και προσαρμόζεται ανάλογα με τις κινήσεις του ποδιού έτσι ώστε να μην αποκολλάται εύκολα από αυτό. Είναι υποαλλεργικό και κατάλληλο ακόμα και για τα πιο ευαίσθητα δέρματα.;Περιποίηση Ποδιών;5012654200755;https://www.vican.gr/pub/media/catalog/product/cache/943338449f392e591c2115a51e5b080b/5/0/5012654200755_t20230418163921.jpg;https://www.vican.gr/el/carnation-fleecy-padding-5012654200755.html
